index,duration,content,startOfParagraph,startTime,ID
965,2514,à investir et à s'occuper d'eux.,False,492962,1832
966,2710,Le sacrifice du buffle,True,495476,1832
967,2687,et l'étalage rituel de la richesse,False,498186,1832
968,3055,"montrent également le statut du défunt,",False,500873,1832
969,3292,"et, par extension, celui de la famille du défunt.",False,503928,1832
970,4128,"Lors des funérailles,  les relations sont reconfirmées",False,507220,1832
971,2313,mais également transformées,False,511348,1832
972,2640,dans une mise en scène rituelle qui met en lumière,False,513661,1832
973,3778,l'aspect le plus marquant de la mort en cet endroit .,False,516301,1832
974,5266,son impact sur la vie  et sur les relations entre vivants.,False,520079,1832
975,2815,Toute cette attention portée à la mort,True,525345,1832
976,2636,ne veut pas dire que  les Torajas n'aspirent pas,False,528160,1832
977,2676,à l'idéal d'une longue vie.,False,530796,1832
978,2069,Ils pratiquent de nombreuses activités,False,533472,1832
979,2128,censées conférer une bonne santé,False,535541,1832
980,2864,et la vie jusqu'à un âge avancé.,False,537669,1832
981,2167,Mais ils ne font pas beaucoup d'effort,False,540533,1832
982,4999,pour prolonger la vie de personnes atteintes de maladies invalidantes,False,542700,1832
983,2655,ou très âgées.,False,547699,1832
984,1863,"A Toraja, il est dit que l'on possède tous",False,550354,1832
985,2737,"une quantité de vie prédéterminée, en quelque sorte.",False,552217,1832
986,1978,On l'appelle le sunga'.,False,554954,1832
987,3068,"Comme un fil, on doit pouvoir  en dérouler la bobine",False,556932,1832
988,2940,jusqu'à sa fin naturelle.,False,560000,1832
989,2548,Considérer la mort comme une partie,True,562940,1832
990,4169,du tissu culturel  et social de la vie,False,565488,1832
991,2973,a une influence sur les décisions  quotidiennes des gens,False,569657,1832
992,3301,quant à leur santé et aux soins.,False,572630,1832
993,3127,"Le patriarche du clan maternel  de mon mari,",False,575931,1832
994,2072,"Nenet Katcha,",False,579058,1832
995,5653,"approche désormais les 100 ans, pour autant qu'on puisse le dire.",False,581130,1832
996,2102,Il y a des signes grandissants,False,586783,1832
997,4643,de son départ proche pour rejoindre Puya.,False,588885,1832
998,4931,On pleurera énormément sa mort.,False,593528,1832
999,2216,Mais je sais que la famille de mon mari,False,598459,1832
1000,2218,se réjouit à l'avance du moment,False,600675,1832
1001,3657,où ils pourront montrer rituellement,False,602893,1832
1002,4733,"ce que sa présence incroyable a signifié dans leur vie,",False,606550,1832
1003,1738,où ils pourront narrer rituellement,False,611283,1832
1004,2015,"le récit de sa vie,",False,613021,1832
1005,1764,tisser les fils de son histoire,False,615036,1832
1006,4022,avec ceux de l'histoire de leur communauté.,False,616800,1832
1007,3832,Son histoire est leur histoire.,False,620822,1832
1008,5772,Ses chants funéraires leur chanteront une chanson sur eux-mêmes.,False,624654,1832
1009,3785,"Et c'est une histoire  sans commencement perceptible,",False,630426,1832
1010,2621,sans fin prévisible.,False,634211,1832
1011,1936,C'est une histoire qui continuera,False,636832,1832
1012,4652,bien après son corps.,False,638768,1832
1013,4520,On me demande si ça me fait peur ou si ça me dégoûte,True,643420,1832
1014,2720,de participer à une culture,False,647940,1832
1015,2671,où l'on rencontre  les manifestations physiques de la mort,False,650660,1832
1016,1779,à chaque coin de rue.,False,653331,1832
1017,3230,Mais moi je vois quelque chose de profondément transformateur,False,655110,1832
1018,3415,dans le fait de vivre la mort comme un processus social,False,658340,1832
1019,3256,et pas seulement  biologique.,False,661755,1832
1020,4064,"En réalité, la relation entre les morts et les vivants",False,665011,1832
1021,3290,est bien l'objet d'une mise en scène dans le système de santé américain .,False,669075,1832
1022,2543,les décisions sur la prolongation du fil de la vie,False,672365,1832
1023,3273,sont prises selon nos liens  émotionnels et sociaux,False,674908,1832
1024,2625,"avec les personnes autour de nous,",False,678181,1832
1025,5119,pas seulement sur la capacité de la médecine à prolonger la vie.,False,680806,1832
1026,2725,"Comme les Torajas, nous basons",False,685925,1832
1027,2795,nos décisions au sujet de la vie,False,688650,1832
1028,3648,sur les significations et les définitions,False,691445,1832
1029,2264,que nous attribuons à la mort.,False,695093,1832
1030,3543,Je ne dis pas que vous tous dans le public,True,697357,1832
1031,2232,devriez courir adopter les traditions,False,700900,1832
1032,1622,des Torajas.,False,703132,1832
1033,1592,Ça serait un peu difficile,False,704754,1832
1034,3334,de les transposer aux Etats-Unis.,False,706346,1832
1035,1881,Mais je pose la question . qu'a-t-on à gagner,False,709680,1832
1036,4439,"à considérer la mort physique  non seulement comme un processus biologique,",False,711561,1832
1037,4492,mais aussi comme un élément de toute l'histoire de l'humanité .,False,716000,1832
1038,2531,Qu'est-ce que cela donnerait,False,720492,1832
1039,3449,"de regarder l'enveloppe corporelle d'un défunt avec amour,",False,723023,1832
1040,3724,parce qu'elle fait intimement partie de ce que nous sommes tous .,False,726472,1832
1041,2887,Si nous pouvions développer notre définition de la mort,False,730196,1832
1042,2411,"pour y inclure la vie,",False,733083,1832
1043,3914,"nous pourrions vivre la mort comme une partie de la vie,",False,735494,1832
1044,2262,et peut-être pourrions nous affronter la mort,False,739408,1832
1045,4463,avec autre chose que de la peur.,False,741670,1832
1046,2943,"Une des réponses, peut-être,",False,746133,1832
1047,2853,"aux défis que doit relever le système de santé américain,",False,749076,1832
1048,2426,"particulièrement en ce qui concerne  la fin de vie,",False,751929,1832
1049,3030,"serait tout simplement de changer de point de vue,",False,754355,1832
1050,2017,"et ce changement, en l’occurrence,",False,757385,1832
1051,5628,serait de regarder les relations humaines impliquées dans chaque décès.,False,759402,1832
1052,3485,Cela nous aiderait peut-être à reconnaître que notre façon,False,765030,1832
1053,1676,de restreindre notre discours sur la mort,False,768515,1832
1054,3035,à l'aspect médical ou biologique,False,770191,1832
1055,3823,"reflète une habitude plus vaste, que nous partageons tous,",False,773226,1832
1056,5650,"d'éviter la mort, d'avoir peur d'en parler.",False,777049,1832
1057,4440,Si nous pouvions concevoir  et valoriser,False,782699,1832
1058,3123,"une autre sorte de connaissances sur la vie,",False,787139,1832
1059,3674,"y compris d'autres définitions de la mort,",False,790262,1832
1060,2202,nous aurions le potentiel pour changer notre discours,False,793936,1832
1061,3747,sur la fin de vie.,False,796138,1832
1062,4093,"Cela pourrait modifier  notre façon de mourir,",False,799885,1832
1063,2012,"mais plus important encore,",False,803978,1832
1064,7102,cela pourrait transformer  notre façon de vivre.,False,805990,1832
1143,5000,Je tend à croire que nous sommes dans la période préhistorique des interfaces d'ordinateurs.,True,0,131
1144,4000,"C'est comme si elles n'étaient pas aussi profondes, ou engageantes émotionnellement qu'elles pourraient l'être,",False,5000,131
1145,2000,et j'aimerais changer tout ça.,False,9000,131
1146,3000,Image s'il vous plaît.,False,11000,131
1147,3000,"Ok. Alors, vous voyez, ceci est le genre de status quo des interfaces, n'est ce pas .",False,14000,131
1148,2000,"C'est très plat, et plutôt rigide.",False,17000,131
1149,4000,"Bon, OK, vous pourriez le rendre un peu plus sexy et aller vers un Mac plus léché,",False,19000,131
1150,4000,"mais c'est quand même la même merde que nous avons eu pendant les dernières,",False,23000,131
1151,2000,"vous savez, 30 années.",False,27000,131
1153,3000,"Je veux dire, je crois que nous endurons beaucoup de merdes avec nos ordinateurs.",False,32000,131
1154,5000,"Je veux dire, on pointe et on clique, c'est comme les menus, les icones, c'est pratiquement du pareil au même.",False,35000,131
1155,4000,Alors un type d'espace contenant de l'information que j'utilise comme inspiration est mon vrai bureau.,True,40000,131
1156,4000,"C'est tellement plus subtil, tellement plus viscéral",False,44000,131
1157,2000,", vous savez, ce qui est visible, ce qui ne l'est pas.",False,48000,131
1158,3000,Et j'aimerais amener cette expérience dans l'espace de travail.,False,50000,131
1159,4000,"Alors j'ai fait , voici BumpTop.",False,53000,131
1160,3000,C'est comme une nouvelle approche par rapport à l'utilisation de l'espace de travail.,False,57000,131
1161,7000,"Alors vous pouvez faire entrer les choses en collision , elles sont physiquement, vous voyez, manipulables,",False,60000,131
1162,3000,"et au lieu de pointer et cliquer, c'est plutôt pousser et tirer,",False,67000,131
1163,4000,"les trucs entrent en collision tels que vous auriez deviné. Comme sur mon vrai bureau,",False,70000,131
1164,3000,"Je peux , laissez moi attraper ceux-ci , Je peux empiler les choses,",False,74000,131
1165,6000,au lieu des dossiers auxquels nous sommes habitués.,False,77000,131
1166,4000,"Et lorsque les choses sont empilées, je peux faire une recherche en les plaçant en grille.",False,83000,131
1167,3000,"ou bien, vous savez, les consulter comme un livre,",False,87000,131
1168,5000,ou je peux les disposer comme un jeu de cartes.,False,90000,131
1169,5000,"Lorsque qu'elles sont exposées, je peux tirer les choses vers un autre endroit, ou en effacer,",False,95000,131
1170,5000,"ou juste organiser toute une pile rapidement, vous savez, immédiatement, d'accord.",False,100000,131
1171,5000,"Et, c'est plutôt bien animé, au lieu des changements brusques que vous voyez dans les interfaces d'aujourd'hui.",False,105000,131
1172,2000,"Aussi, si je veux ajouter quelque chose à une pile, et bien, comment je fais .",True,110000,131
1173,6000,"Je n'ai qu'à l'envoyer sur la pile, et c'est ajouté sur le dessus. C'est plutôt bien.",False,112000,131
1174,2000,"Aussi, d'autres trucs que nous pouvons faire",False,118000,131
1175,2000,"pour ces icones individuelles nous nous sommes dits , je veux dire,",False,120000,131
1176,3000,"comment peut-on jouer avec le concept d'icone, et pousser l'idée plus loin.",False,122000,131
1177,3000,Une des choses que je peux faire est de l'agrandir,False,125000,131
1178,2000,si je veux y mettre l'emphase et la rendre plus importante.,False,128000,131
1179,4000,"Mais ce qui est vraiment bien c'est que puisqu'il y a un simulateur pour les lois de la physique qui travaille derrière tout ça,",True,130000,131
1180,5000,elle devient plus lourde. Alors les trucs plus légers ne bougent pas vraiment,False,134000,131
1181,4000,"Mais si je la lance sur les plus petits, vous voyez.",False,139000,131
1183,5000,"Alors c'est mignon, mais c'est un aussi une façon subtile de faire passer de l'information.",False,146000,131
1184,3000,"Ceci est lourd, alors ça semble plus important. Alors c'est plutôt bien.",False,151000,131
1185,3000,"Même s'il y a des ordinateurs partout, le papier n'a pas vraiment disparu,",True,154000,131
1186,2000,"parce qu'il a beaucoup de, je crois, propriétés intéressantes.",False,157000,131
1187,3000,Et nous voulions transférer certaines d'entre elles aux icones dans notre système.,False,159000,131
1188,4000,"Alors une des choses que vous pouvez faire avec nos icones, comme avec du vrai papier, est de les plier.",False,162000,131
1189,4000,Comme du papier. Pour vous rappeler de quelque chose pour plus tard.,False,166000,131
1190,3000,"Ou, si vous voulez détruire quelque chose, vous pouvez le chiffonner,",False,170000,131
1191,3000,et le lancer dans le coin.,False,173000,131
1192,3000,"Aussi, comme avec du papier, dans notre espace de travail",False,176000,131
1193,2000,"nous collons des choses sur le mur pour nous en rappeler plus tard,",False,179000,131
1194,3000,"et je peux faire la même chose ici,",False,181000,131
1195,3000,"et vous savez, vous voyez des notes post-it et des choses comme ça dans le bureau des gens.",False,184000,131
1196,2000,Et je peux les prendre du mur lorsque je veux travailler avec.,False,187000,131
1197,5000,"Alors, une des critiques que cette approche organisationelle reçoit est,",True,189000,131
1198,4000,"vous savez, D'accord, mon bureau est complètement en désordre. je ne veux pas ce désordre dans mon ordinateur.",False,194000,131
1199,3000,"Alors, une solution que nous avons est une sorte d'alignement en grille,",False,198000,131
1200,4000,"comme , alors vous obtenez un espace de travail plus traditionnel. Les choses sont plutôt alignées en grille.",False,201000,131
1201,3000,"Plus ennuyeux, mais vous pouvez toujours faire des collisions et pousser les choses.",False,205000,131
1202,7000,Et vous pouvez toujours faire des choses amusantes comme construire une étagère sur votre espace de travail.,False,208000,131
1203,3000,"Brisons cette étagère. Voilà, l'étagère est brisée.",True,215000,131
1204,5000,"Je crois que au-delà des icones, un autre domaine d'application pour ce programme ,",False,218000,131
1205,6000,"Je crois que ça s'applique à plus que seulement les icones et à votre espace de travail , mais à l'organisation de photos.",False,223000,131
1206,3000,Je crois que l'on peut vraiment enrichir la façon dont nous parcourons nos photos.,False,229000,131
1207,5000,et la rendre comme si vous étiez avec votre famille sur la table de cuisine à regarder vos photos qui sont dans une boîte à chaussures.,False,232000,131
1208,3000,"Et je peux déplacer ces trucs. Ils sont tellement plus tangibles lorsque , et manipulables ,",False,237000,131
1209,3000,"et vous savez, je peux double-cliquer sur quelque chose pour le regarder.",False,240000,131
1210,2000,Et je peux faire tous les trucs que je vous ai déjà montrés.,False,243000,131
1211,3000,"Alors je peux empiler les choses, je peux les consulter, je peux, vous voyez ,",False,245000,131
1212,6000,"Alors, déplaçons cette photo à l'arrière, effaçons celle-là,",False,248000,131
1213,4000,et je crois qu'il s'agit d'une façon beaucoup plus riche d'interagir avec vos données.,False,254000,131
1214,4000,Et voilà BumpTop. Merci.,True,258000,131
1215,3650,Chris Anderson . Peut-être pouvons-nous  commencer en parlant de votre pays.,True,760,2379
1216,3870,"Ce sont trois points sur le globe,  des points assez gigantesques.",False,4410,2379
1217,2690,Chacun fait à peu près  la taille de la Californie.,False,8280,2379
1218,1916,Parlez-nous des Kiribati.,False,10970,2379
1219,4520,Anote Tong . Laissez-moi commencer  par dire combien je suis reconnaissant,True,12886,2379
1220,2274,pour cette opportunité  de partager mon histoire,False,17406,2379
1221,1880,avec des personnes qui s'y intéressent.,False,19680,2379
1222,5570,J'ai partagé mon histoire avec beaucoup  de gens qui ne s'en soucient pas vraiment.,False,21560,2379
1223,3916,Les Kiribati sont composées  de trois archipels .,False,27130,2379
1224,2840,"les îles Gilbert à l'ouest,",False,31046,2379
1225,3360,"nous avons les îles Phoenix au milieu,",False,33886,2379
1226,4440,et les îles de la Ligne à l'est.,False,37246,2379
1227,3110,"Très honnêtement,  les Kiribati sont peut-être le seul pays",False,41686,2379
1228,2385,à réellement se trouver  aux quatre coins du monde.,False,44796,2379
1229,2669,"Nous sommes dans l'hémisphère nord  et l'hémisphère sud,",False,47181,2379
1230,3630,ainsi qu'à l'est et à l'ouest  de la ligne de changement de date.,False,49850,2379
1231,6410,"Ces îles sont des atolls,  entièrement faites de corail,",False,53480,2379
1232,4959,et se trouvent en moyenne à peu près  deux mètres au-dessus du niveau de la mer.,False,59890,2379
1233,3481,Voici ce que nous avons.,False,64849,2379
1234,4840,"En général, pas plus  de deux kilomètres de large.",False,68330,2379
1235,2950,"À bien des occasions,  des gens m'ont demandé .",False,73170,2379
1236,2560," Vous souffrez,  pourquoi vous ne reculez pas . ",False,76120,2379
1237,5006,Ils ne comprennent pas. Ils n'ont pas  la moindre idée de ce qui est en jeu.,False,78680,2379
1238,3570,"Avec la montée de la mer, ils disent .   Eh bien, vous pouvez reculez. ",False,83686,2379
1239,1626,Voici ce que je leur réponds.,False,87260,2379
1240,4324,"Si nous reculons, nous allons tomber  de l'autre côté de l'océan. Okay .",False,88886,2379
1241,4800,Mais les gens ne comprennent pas  ce genre de problèmes.,False,93210,2379
1242,4240,CA . Voici certainement un état de vulnérabilité ici.,True,98010,2379
1243,2550,Quand avez-vous réalisé  par vous-même,False,102250,2379
1244,3650,le danger imminent  auquel votre pays pourrait faire face .,False,104800,2379
1245,3330,AT . L'histoire du changement  climatique se déroule,True,108450,2379
1246,2446,depuis un certain nombre de décennies.,False,111780,2379
1247,3944,"Lorsque j'ai pris mes fonctions en 2003,",False,114226,2379
1248,2660,j'ai commencé à parler  du changement climatique,False,118170,2379
1249,4420,"à l'Assemblée Générale des Nations-Unies, mais sans trop de passion,",False,120830,2379
1250,3590,"parce qu'à l'époque, les scientifiques  étaient encore en train de débattre",False,125250,2379
1251,5336,"si le phénomène était d'origine humaine,  et s'il était réel ou non.",False,128840,2379
1252,6114,Je crois que ce débat  s'est plus ou moins conclu en 2007,False,134176,2379
1253,5590,"avec le quatrième rapport  d'évaluation du GIEC,",False,140290,2379
1254,4160,qui a catégoriquement déclaré  ,False,145880,2379
1255,2760,"que ce phénomène est réel  et d'origine humaine,",False,150040,2379
1256,3930,et qu'il augure de très sérieux scénarios,False,152800,2379
1257,2560,pour des pays comme le mien.,False,156730,2379
1258,3280,C'est là que j'ai commencé  à prendre la chose très au sérieux.,False,159290,2379
1259,4000,"Dans le passé, j'en ai parlé.",False,162570,2379
1260,1276,Nous étions inquiets.,False,166570,2379
1261,3714,"Mais lorsque les scénarios,  les prédictions furent annoncés en 2007,",False,167846,2379
1262,2370,le changement climatique  devint un vrai problème.,False,171560,2379
1263,5630,"CA . Ces prédictions disent,  je crois, que d'ici 2100,",True,173930,2379
1264,2810,le niveau de la mer  devrait monter de près d'un mètre.,False,179560,2379
1265,2570,"Certains scénarios sont plus alarmistes, c'est certain.",False,182370,2379
1266,2240,Que répondriez-vous  à un sceptique qui dirait .,False,184940,2379
1267,1190, Qu'est-ce qu'un mètre .,False,187184,2379
1268,2252,Vous êtes à deux mètres du niveau de la mer.,False,188374,2379
1269,1600,Quel est le problème . ,False,190626,2379
1270,2014,Je crois qu'il est important  de comprendre,True,192226,2379
1271,2080,qu'une montée marginale du niveau de la mer,False,194240,2379
1272,2600,"signifie la perte  d'une grande surface de terrain,",False,196320,2379
1273,3290,parce que beaucoup  de terrain est à basse altitude.,False,198920,2379
1274,5110,"Et mis à part ça, nous pouvons sentir  la houle en ce moment.",False,202210,2379
1275,2200,Ça n'a rien à voir avec un mètre.,False,207320,2379
1276,3050,"Ce que beaucoup  de gens ne comprennent pas,",False,209520,2379
1277,6190,c'est qu'ils pensent que le changement  climatique est pour plus tard.,False,212570,2379
1278,2850,Nous sommes tout en bas de l'échelle.,False,218760,2379
1279,1270,Il est déjà avec nous.,False,221610,2379
1280,3850,Nous avons des communautés  qui ont déjà été déplacées.,False,222880,2379
1281,3960,"Elles ont dû déménager,  et à chaque session parlementaire,",False,226730,2379
1282,2360,je reçois des plaintes  de communautés différentes,False,230690,2379
1283,3080,"demandant de l'aide pour construire des digues,",False,233050,2379
1284,2540,"pour s'occuper de la lentille d'eau douce,",False,236130,2379
1285,1860,parce qu'elle se détériore.,False,238670,2379
1286,2796,"Lors de mes voyages  sur les différentes îles,",False,240530,2379
1287,2690,je vois des communautés,False,243326,2379
1288,3620,"qui doivent désormais  gérer la perte de récoltes,",False,246020,2379
1289,3656,"la contamination des lentilles d'eau,",False,249640,2379
1290,4314,"et je vois ces communautés  peut-être partir, avoir à déménager,",False,253296,2379
1291,2350,d'ici cinq à dix ans.,False,257610,2379
1292,3976,"CA . Puis je crois que le pays  a connu son premier cyclone,",True,259960,2379
1293,1450,"et c'est lié, n'est-ce pas .",False,263940,2379
1294,2130,Que s'est-il passé .,False,265390,2379
1295,2680,"AT . Nous sommes sur l'équateur,",True,267520,2379
1296,4400,"et je suis sûr que beaucoup d'entre vous  savent qu'en étant sur l'équateur,",False,270200,2379
1297,3070,"nous sommes censés être  dans une zone de calme, sans cyclone.",False,274600,2379
1298,3404,"Nous les créons, puis nous les envoyons  soit au nord, soit au sud.",False,277670,2379
1300,2170,Mais ils ne sont pas censés revenir.,True,282180,2379
1301,2498,"Pour la première fois,  au début de cette année,",False,284350,2379
1302,3752,"le cyclone Pam a détruit Vanuatu,",False,286848,2379
1303,3480,"et dans sa course,  ses extrémités ont touché",False,290600,2379
1304,2350,nos deux îles les plus au sud.,False,294080,2379
1305,5460,Toute l'île de Tuvalu était sous l'eau  lorsque l'ouragan Pam l'a touchée.,False,296430,2379
1306,3720,Mais nos deux îles au sud,False,301890,2379
1307,3350,"ont eu des vagues  qui ont recouvert la moitié de l'île,",False,305610,2379
1308,2490,et ça n'est jamais arrivé auparavant.,False,308960,2379
1309,1590,C'est une nouvelle expérience.,False,311450,2379
1310,5360,"Je reviens juste de ma circonscription,",False,313040,2379
1311,3360,et j'ai vu ces arbres magnifiques  qui étaient là depuis des décennies.,False,318400,2379
1312,2000,Ils ont été complètement détruits.,False,321760,2379
1313,1776,"Voici ce qui se passe,",False,323760,2379
1314,3870,"mais lorsque nous parlons  de la montée du niveau de la mer,",False,325536,2379
1315,3084,nous pensons à quelque chose  qui survient petit à petit.,False,329406,2379
1316,3070,"Elle vient avec les vents,  elle vient avec la houle,",False,332490,2379
1317,1950,et ce phénomène  peut donc être amplifié.,False,335560,2379
1318,3250,Nous commençons à observer,False,337510,2379
1319,3000,"le changement  des conditions météorologiques,",False,340760,2379
1320,2730,et c'est peut-être le défi le plus urgent,False,343760,2379
1321,4560,"auquel nous allons faire face, avant la montée du niveau de la mer.",False,346490,2379
1322,3200,CA . Le pays en observe déjà les effets.,True,351050,2379
1323,2280,"En vous projetant dans le futur,",False,354250,2379
1324,3960,"quelles sont vos options,  en tant que pays, en tant que nation .",False,356530,2379
1325,2646,AT . Je raconte cette histoire  tous les ans.,True,360490,2379
1326,1537,Je visite un certain nombre de —,False,363136,2379
1327,4927,je voyage à travers le monde  pour essayer de sensibiliser les gens.,False,364673,2379
1328,2490,"Nous avons un plan,  nous pensons avoir un plan.",False,369600,2379
1329,3440,"Une fois, je crois que c'était lors  d'une conférence à Genève,",False,372090,2379
1330,5740,"un monsieur m'interviewait sur un sujet similaire,",False,375530,2379
1331,2616,et j'ai dit .   Nous considérons les îles flottantes .,False,381270,2379
1332,2110,"Il a trouvé ça drôle,  mais quelqu'un a dit .",False,383886,2379
1333,4090, Ce n'est pas drôle.  Ces gens cherchent des solutions. ,False,385996,2379
1334,3530,"Et donc,  je considère les îles flottantes.",False,390086,2379
1335,3730,Les Japonais sont intéressés  par la construction d'îles flottantes.,False,393620,2379
1336,2980,"En tant que pays,  nous nous sommes engagés,",True,397350,2379
1337,3720,"quoiqu'il arrive,  à essayer autant que possible",False,400330,2379
1338,4200,de rester et de continuer  à exister en tant que nation.,False,404050,2379
1339,5010,"Les mesures que nous devrons prendre seront assez importantes,",False,408250,2379
1340,1970,"et très, très considérables.",False,413260,2379
1341,1956,"Soit nous vivons sur des îles flottantes,",False,415230,2379
1342,3904,soit nous devons développer les îles  pour continuer à rester hors de l'eau,False,417186,2379
1343,4760,pendant que la mer monte  et que les orages empirent.,False,421090,2379
1344,2453,"Mais même ça,  il va être très, très difficile",False,425850,2379
1345,2867,de réunir les ressources dont nous aurions besoin.,False,428303,2379
1346,3880,"CA . Et alors, une forme de migration  forcée sera la seule solution.",True,431170,2379
1347,2286,"AT . Nous considérons aussi cette option,",True,435050,2379
1348,4634,"parce que si jamais rien ne venait de la communauté internationale,",False,437336,2379
1349,1326,nous nous préparons.,False,441970,2379
1350,3344,Nous ne voulons pas être pris  dans une situation similaire à l'Europe.,False,443296,2379
1351,2650,D'accord . Nous ne voulons  pas un jour migrer en masse.,False,446640,2379
1352,3430,"Nous voulons pouvoir donner  le choix aux gens aujourd'hui,",False,449290,2379
1353,3690,"ceux qui choisissent et veulent faire ça, de migrer.",False,452720,2379
1354,2580,Nous ne voulons pas  que quelque chose arrive,False,456410,2379
1355,4860,et qu'ils soient forcés à migrer sans y avoir été préparés.,False,458990,2379
1356,3480,"Bien sûr, notre culture  et notre société sont très différentes,",False,463850,2379
1357,3636,"et lorsque nous migrons dans une culture  et un environnement différents,",False,467330,2379
1358,2930,beaucoup d'ajustements sont requis.,False,470966,2379
