index,duration,content,startOfParagraph,startTime,ID
2493,3966,Mais on leur avait dit que le succès signifiait laisser le village derrière soi,False,519770,2580
2494,2676,et poursuivre l’icône symbolique du rêve américain .,False,523736,2580
2495,1526,la clôture à piquets blancs.,False,526436,2580
2496,3554,"Encore aujourd'hui, quand on voit une clôture blanche, on pense au succès,",False,528330,2580
2497,997,à l'assurance.,False,531884,2580
2498,5201,"Mais quand on enlève la sentimentalité, ce que ça fait, c'est que ça nous sépare.",False,532905,2580
2499,2833,Beaucoup d'Américains rejettent la clôture à piquets blancs,False,538140,2580
2500,2979,"et le genre de vie hautement privatisée qu'elle implique,",False,540973,2580
2501,5004,"pour reprendre une vie de village, pour la remplacer par l'interdépendance.",False,543952,2580
2502,4453,Cinquante millions d'entre nous vivent dans des foyers intergénérationnels.,True,549311,2580
2503,2308,"Ce nombre a explosé avec la crise, ",False,554018,2580
2504,3082,mais il s'avère que les gens aiment bien cette façon de vivre.,False,556326,2580
2505,3848,Les deux tiers de ceux qui vivent à plusieurs générations sous un même toit,False,559432,2580
2506,2369,disent que leurs relations  se sont améliorées.,False,563304,2580
2507,3064,"D'autres choisissent de partager  leur foyer non avec la famille,",False,566005,2580
2508,3264,mais avec ceux qui comprennent les avantages économiques et médicaux,False,569069,2580
2509,1725,du quotidien communautaire.,False,572333,2580
2510,3864,"CoAbode, un site en ligne pour les mères seules cherchant à partager une maison",False,574082,2580
2511,3697,"avec d'autres mères célibataires, a 50 000 utilisateurs.",False,577946,2580
2512,3055,Et les personnes de plus de 65 ans sont particulièrement enclines,False,581643,2580
2513,3303,à chercher ce type d'habitation alternative.,False,584698,2580
2514,4849,Elles comprennent que la qualité de vie dépend d'un mélange de solitude,False,588074,2580
2515,2353,et de solidarité.,False,592923,2580
2516,3931,"Ce qui est vrai pour chacun d'entre nous, si on y réfléchit, tous âges confondus.",False,595527,2580
2517,4295,Trop longtemps nous avons prétendu que le bonheur était d'être riche.,False,599458,2580
2518,2371,Mais les recherches prouvent le contraire.,False,604306,2580
2519,3473,"Les personnes en meilleure santé, les plus heureuses et en sécurité ,",False,607006,2580
2520,5232,"face aux catastrophes climatiques,  aux crimes, etc. ,",False,610479,2580
2521,4442,sont les Américains dont les vies sont entremêlées à celles de leurs voisins.,False,615711,2580
2522,2367,Je l'ai moi-même expérimenté.,True,620661,2580
2523,3186,"Depuis quelques années, je vis dans une habitation communautaire.",False,623076,2580
2524,6259,"Il y a 0,6 hectare de plaqueminiers, ce mûrier qui prolifère comme un serpent",False,626262,2580
2525,4456,"dans un jardin communautaire, au milieu de la zone urbaine d'Oakland.",False,632521,2580
2526,3696,"Les neuf unités sont toutes différentes, par leurs tailles et formes,",False,637447,2580
2527,2208,mais elles sont aussi écologiques que possible.,False,641143,2580
2528,3663,De grands panneaux solaires sur notre toit font que les factures d'électricité,False,643351,2580
2529,2350,rarement dépassent cinq dollars par mois.,False,647014,2580
2530,3785,"Les 25 habitants différent de par leurs âges, idées politiques",False,649757,2580
2531,1098,et professions.,False,653542,2580
2532,3334,Et on habite des maisons qui ont tout  ce qu'une maison normale aurait.,False,654640,2580
2533,4816,"En plus, on partage une énorme cuisine et salle à manger où on partage nos repas",False,657974,2580
2534,1159,deux fois par semaine.,False,662790,2580
2535,4054,"Quand je dis que je vis comme ça, les gens ont souvent une réaction extrême.",False,663949,2580
2536,2806,Soit ils disent .  Tout le monde devrait vivre comme ça . ,False,668003,2580
2537,4125,"Ou ils disent .  C'est horrible,  jamais je n'aurais envie de faire ça . ",False,670809,2580
2538,5497,Je vais vous rassurer . il y a un respect sacré pour la vie privée de chacun.,False,674934,2580
2539,4317,Mais on respecte aussi ce qu'on appelle  l'hospitalité radicale.,False,680614,2580
2540,6893,"Pas celle qui sert de pub pour les hôtels, mais celle qui veut que chaque personne",False,685275,2580
2541,4143,"mérite de la bienveillance,  un point c'est tout.",False,692168,2580
2542,3477,Qu'est-ce qui me surprend le plus  dans une vie comme celle-ci .,True,697129,2580
2543,3545,"On partage toutes les tâches domestiques, réparations, cuisine, désherbage,",False,701055,2580
2544,2573,mais on partage aussi le travail émotionnel.,False,704600,2580
2545,3437,Plutôt que de dépendre uniquement sur l'unité familiale habituelle,False,707303,2580
2546,2110,"pour le soutien émotionnel dont on a besoin,",False,710740,2580
2547,1728,il y a vingt autres personnes,False,712850,2580
2548,2513,pour parler d'une journée de travail difficile,False,714578,2580
2549,2909,ou pour trouver des solutions au harcèlement d'un professeur.,False,717091,2580
2550,4548,Les ados de notre communauté vont souvent demander conseil à des adultes,False,720038,2580
2551,2299,qui ne sont pas leurs parents.,False,724586,2580
2552,3639,C'est ce que bell hooks a appelé  révolution de la pratique parentale  .,False,727140,2580
2553,3342,cette humble reconnaissance du fait que les enfants se portent mieux,False,730779,2580
2554,4110,s'ils ont davantage d'adultes pour les émuler et sur qui compter.,False,734121,2580
2555,2701,Et les adultes se portent mieux aussi.,False,738451,2580
2556,3598,C'est beaucoup de pression d'essayer  d'être la famille parfaite,False,741568,2580
2557,2038,derrière les clôtures blanches.,False,745166,2580
2558,2314,"Le nouveau  mieux loti , comme je l'ai appelé,",True,748290,2580
2559,2503,c'est investir moins dans une famille parfaite,False,750604,2580
2560,3950,et investir plus dans un village imparfait .,False,753107,2580
2561,2176,"des proches vivant sous un même toit,",False,757057,2580
2562,2154,une communauté de cohabitation comme la mienne,False,759233,2580
2563,4614,ou juste quelques voisins qui souhaitent se connaître et vraiment s’entraider.,False,761387,2580
2564,1869,"C'est du bon sens, non .",False,766134,2580
2565,4697,L'argent nous a souvent rendus incapables de tendre la main.,False,768466,2580
2566,5283,La richesse qui compte vraiment se trouve dans les relations.,False,773575,2580
2567,3520,Le nouveau  mieux loti  n'est pas une perspective individuelle.,True,779511,2580
2568,2809,"En fait, si vous êtes un raté ou si vous pensez l'être,",False,783384,2580
2569,3555,j'ai de bonnes nouvelles pour vous .  vous pourriez réussir,False,786193,2580
2570,2674,selon des critères que vous n'avez pas encore honorés.,False,789748,2580
2571,3765,"Vous pourriez être une source de revenu  médiocre, mais un très bon père.",False,792422,2580
2572,2892,"Peut-être vous ne pouvez pas acheter la maison de vos rêves,",False,796187,2580
2573,2980,mais vous organisez des soirées inoubliables.,False,799079,2580
2574,3654,"Si vous êtes un cas typique de succès, les implications de ce que j'ai à dire",False,802212,2580
2575,2035,vous paraitront peut-être sombres.,False,805866,2580
2576,3285,Vous pourriez être un raté selon des critères qui vous sont chers,False,808344,2580
2577,2632,mais pour lesquels il n'y a pas de récompense.,False,811629,2580
2578,1550,Vous seul savez.,False,814719,2580
2579,4396,"Je ne serais pas un hommage à mon arrière-grande-mère,",True,817310,2580
2580,3908,"dont la vie a été courte et dure,  si je gagnais assez d'argent",False,821706,2580
2581,2900,pour me permettre tous les conforts.,False,825614,2580
2582,3489,On ne peut pas acheter le chemin qui mène de la souffrance au sens.,False,828514,2580
2583,5138,Il n'y a pas de maison assez grande pour effacer la douleur qu'elle a dû souffrir.,False,832003,2580
2584,4674,Je suis un hommage à elle si je mène une vie avec autant de liens et de courage,False,837141,2580
2585,1541,que possible.,False,841815,2580
2586,5551,"Au milieu de tant d'incertitude, nous pouvons nous sentir peu assurés.",False,844296,2580
2587,3026,Mais nous pouvons laisser cette incertitude nous fragiliser,False,850334,2580
2588,1345,ou nous assouplir.,False,853360,2580
2589,3857,"On peut se refermer sur soi,  perdre la foi dans la capacité",False,854859,2580
2590,3628,"des institutions de changer , et même perdre la foi en soi-même.",False,858716,2580
2591,5262,"Ou on peut s'ouvrir, cultiver la foi  en notre capacité de tendre la main,",False,862404,2580
2592,2529,"lier des contacts, créer.",False,867666,2580
2593,3561,Il s'avère que le plus grand danger n'est pas d'échouer,True,871063,2580
2594,3000,à réaliser le rêve américain.,False,874624,2580
2595,5648,Le plus grand danger est de réaliser  un rêve auquel on ne croit pas vraiment.,False,877624,2580
2596,1350,Ne faites pas ça.,False,883362,2580
2597,2792,"Faites ce qui est plus difficile,  plus intéressant,",False,885046,2580
2598,3582,"à savoir composer une vie où ce que vous faites chaque jour,",False,887838,2580
2599,3972,"les personnes à qui vous donnez votre amour, ingéniosité et énergie,",False,891420,2580
2600,3464,correspondent au mieux à ce en quoi vous croyez.,False,895392,2580
2601,5742,"C'est cela, et non pas gagner de l'argent, qui est un hommage à vos ancêtres.",False,898910,2580
2602,3821,"C'est ça, la lutte magnifique.",False,904652,2580
2603,1191,Merci.,True,908861,2580
2607,2983,Je t'ai eu.,True,13034,1445
2608,3724,Je hais les moustiques.,True,16017,1445
2609,1768,Pas vous .,False,19741,1445
2610,3091,Cet horrible bourdonnement la nuit  dans vos oreilles,False,21509,1445
2611,2371,qui vous rend complètement fou .,False,24600,1445
2612,2214,Sachant qu'elle veut vous planter  une aiguille dans la peau,False,26971,1445
2613,4086,"et sucer votre sang . C'est horrible, non .",False,29185,1445
2614,3381,"En fait, quand on parle de moustiques,  je ne peux penser",False,33271,1445
2615,2380,qu'à une seule bonne chose.,False,36652,1445
2616,2711,"Quand ils entrent dans notre chambre la nuit,",False,39032,1445
2617,3105,ils préfèrent piquer ma femme.,False,41743,1445
2618,1209,"Mais c'est fascinant, non .",True,44848,1445
2619,4606,Pourquoi est-ce qu'elle reçoit  plus de piqûres que moi .,False,46057,1445
2620,4192,"La réponse est l'odeur, l'odeur de son corps.",False,50663,1445
2621,2650,Et puisque nous avons tous une odeur différente et produisons des substances chimiques,False,54855,1445
2622,4477,"sur notre peau cela attire ou repousse les moustiques,",False,57505,1445
2623,3432,certains d'entre nous sont  juste plus attrayants que d'autres.,False,61982,1445
2624,3230,"Ma femme a une odeur plus agréable que moi,",False,65414,1445
2625,2786,ou je sens plus mauvais qu'elle.,False,68644,1445
2626,3581,"Quoi qu'il en soit, les moustiques  nous trouvent dans l'obscurité",True,71430,1445
2627,2735,en nous repérant à l'odeur. Ils nous sentent.,False,75011,1445
2628,2710,"Quand je faisais mon doctorat,  je voulais savoir exactement",False,77746,1445
2629,2756,"quels composants chimiques de notre peau  les moustiques utilisaient,",False,80456,1445
2630,3781,les moustiques malariques africains utilisent pour nous trouver dans la nuit.,False,83212,1445
2631,3568,"Ils utilisent toute une gamme de composés,",False,86993,1445
2632,3027,La tâche n'allait pas être facile.,False,90561,1445
2633,3105,Nous avons donc mis en place diverses expériences.,False,93588,1445
2634,2868,Pourquoi les avons-nous mises en place .,False,96693,1445
2635,3353,Parce que la moitié de la population mondiale  court le risque,False,99561,1445
2636,3206,de contracter une maladie mortelle comme le paludisme,False,102914,1445
2637,2702,par une simple piqûre de moustique.,False,106120,1445
2638,2367,"Toutes les 30 secondes,  quelque part sur cette planète,",False,108822,1445
2639,3671,"un enfant meurt du paludisme  et Paul Levy, ce matin",False,111189,1445
2640,3847,parlait de la métaphore du 727  s'écrasant sur les États-Unis.,False,114860,1445
2641,5581,"Eh bien, en Afrique, nous avons l'équivalent  de sept jumbo-jets 747",False,118707,1445
2642,2801,qui s'écrasent tous les jours.,False,124288,1445
2643,3241,"Mais peut-être que si nous pouvons attirer  ces moustiques vers des pièges,",False,127089,1445
2644,3701,"les appâter avec notre odeur,  nous pourrons peut-être arrêter la transmission",False,130330,1445
2645,1830,de maladies.,False,134031,1445
2646,2248,"Résoudre ce casse-tête n'était pas une chose facile,",True,135861,1445
2647,3237,"parce que nous fabriquons des centaines  de composés chimiques différents sur la peau,",False,138109,1445
2648,2417,mais nous avons entrepris  des expériences remarquables,False,141346,1445
2649,3792,qui nous ont permis de résoudre  ce casse-tête très rapidement.,False,143763,1445
2650,3363,"Tout d'abord, nous avons observé que  toutes les espèces de moustiques",True,147555,1445
2651,3848,ne piquent pas sur la même partie du corps. Étrange.,False,150918,1445
2652,1619,Nous avons donc mis en place une expérience,False,154766,1445
2653,3612,"selon laquelle nous avons mis un bénévole nu  dans une grande cage,",False,156385,1445
2654,3139,"et dans cette cage, nous avons lâché  des moustiques",False,159997,1445
2655,3319,pour voir où ils piquaient  sur le corps de cette personne.,False,163136,1445
2656,2599,Et nous avons trouvé des différences remarquables.,False,166455,1445
2657,2363,"Sur la gauche ici, vous voyez les piqûres",False,169054,1445
2658,2925,du moustique malarique néerlandais  sur cette personne.,False,171417,1445
2659,3028,Ils avaient une très forte préférence  pour piquer sur le visage.,False,174342,1445
2660,2462,"En revanche, le moustique malarique africain",False,177370,1445
2661,5805,"avait une très forte préférence pour piquer  les chevilles et les pieds de cette personne,",False,179832,1445
2662,2465,et bien sûr nous aurions dû le savoir depuis le début,False,185637,1445
2663,4472,"parce qu'on les appelle mosqui-toes en anglais .  , ",False,188102,1445
2664,3107,C'est vrai. ,False,192574,1445
2665,5653,"Nous avons donc commencé par nous concentrer  sur l'odeur des pieds,",True,195681,1445
2666,1572,"sur l'odeur des pieds humains,",False,201334,1445
2667,3702,jusqu'à ce que nous tombions sur une déclaration  remarquable dans la littérature,False,202906,1445
2668,3658,qui disait que les odeurs de fromage  rappelaient celles des pieds,False,206608,1445
2669,4082,plutôt que l'inverse. Pensez-y.,False,210266,1445
2670,2259,Et ça nous a poussé à faire  une expérience remarquable.,False,214348,1445
2671,4379,"Nous avons essayé, avec un minuscule petit morceau de fromage Limburger,",False,216607,1445
2672,2672,"qui sent terriblement les pieds,",False,220986,1445
2673,2497,pour attirer les moustiques malariques africains.,False,223658,1445
2674,2732,Et vous savez quoi . Ça a marché.,False,226155,1445
2675,5335,"En fait, ça a si bien marché que maintenant  nous avons un mélange synthétique",False,228887,1445
2676,4514,de l'arôme de fromage Limburger  que nous utilisons en Tanzanie,False,234222,1445
2677,2112,et qui s'est montré là-bas deux à trois fois,False,238736,1445
2678,3882,plus attrayant pour les moustiques que les humains.,False,240848,1445
2679,3521,"Limbourg, soyez fier de votre fromage,",False,244730,1445
2680,3197,puisqu'il est maintenant utilisé  dans la lutte contre le paludisme.,False,248251,1445
2682,2934,"C'est le fromage, juste pour vous montrer.",False,258244,1445
2683,3179,Ma deuxième histoire est tout aussi remarquable.,True,261178,1445
2684,3615,Il s'agit du meilleur ami de l'homme.  Il s'agit de chiens.,False,264357,1445
2685,993,Et je vais vous montrer,False,267972,1445
2686,3137,comment nous pouvons utiliser des chiens  dans la lutte contre le paludisme.,False,268965,1445
2687,3668,Une des meilleures façons de tuer les moustiques,False,272102,1445
2688,2955,est de ne pas attendre qu'ils deviennent adultes et volent autour des gens,False,275770,1445
2689,3087,pour les piquer et transmettent la maladie.,False,278725,1445
2690,3903,C'est de les tuer quand ils sont encore dans l'eau  sous forme de larves.,False,281812,1445
2691,4725,Pourquoi . Parce qu'ils sont comme la CIA.,False,285715,1445
2692,4152,"Dans ce bassin d'eau, ces larves sont concentrées.",False,290440,1445
2693,2682,Elles sont toutes là. Elles sont immobiles.,False,294592,1445
2694,3168,Elles ne peuvent pas s'échapper de cette eau.  Elles ne peuvent pas voler.,False,297274,1445
2695,3457,"Et elles sont accessibles. En fait, vous pouvez  aller jusqu'à ce bassin",False,300442,1445
2696,4259,"et vous pouvez les tuer là, pas vrai .",False,303899,1445
2697,3872,Donc le problème auquel nous sommes confrontés ici,True,308158,1445
2698,3161,"c'est que sur le terrain, tous ces bassins d'eau",False,312030,1445
2699,2723,"pleins de larves sont totalement dispersés,",False,315191,1445
2700,2908,ce qui rend très difficile  pour un inspecteur comme celui-ci,False,317914,1445
2701,3978,de trouver tous ces sites de reproduction  et de les traiter avec des insecticides.,False,320822,1445
2702,2531,"L'an dernier, nous avons beaucoup réfléchi,",False,324800,1445
2703,3375,à la façon de résoudre ce problème.  Jusqu'à ce que nous nous rendions compte,False,327331,1445
2704,3263,"que tout comme nous,  nous avons une odeur particulière,",False,330706,1445
2705,4511,les larves de moustiques ont aussi une odeur très particulière.,False,333969,1445
2706,2093,"Et nous avons mis en place  une autre expérience folle,",True,338480,1445
2707,2072,"parce que nous avons recueilli l'odeur de ces larves,",False,340573,1445
2708,4366,"nous l'avons mise sur des morceaux de tissu,  et puis avons fait une chose tout à fait remarquable.",False,342645,1445
2709,2393,"Ici nous avons une barre avec quatre trous,",False,347011,1445
2710,2803,et nous avons mis l'odeur de ces larves  dans le trou de gauche.,False,349404,1445
2711,1075,"Ooh, c'était très rapide.",False,352207,1445
2712,2444,Et puis vous voyez le chien. Il s'appelle Tweed.  C'est un border collie.,False,353282,1445
2713,2915,"Il examine ces trous, et maintenant il a déjà trouvé.",False,355726,1445
2714,2497,Il va revenir pour vérifier encore une fois les trous de contrôle,False,358641,1445
2715,1483,"mais il va revenir au premier,",False,361138,1445
2716,2657,"et maintenant il reste fixé sur cette odeur,",False,362621,1445
2717,2230,ce qui signifie que maintenant  nous pouvons utiliser les chiens,False,365278,1445
2718,2328,avec ces inspecteurs pour trouver plus efficacement,False,367508,1445
2719,2384,"les sites de reproduction des moustiques  sur le terrain,",False,369836,1445
2720,2869,et par conséquent avoir un impact  beaucoup plus grand sur le paludisme.,False,372220,1445
2721,3714,"Cette dame est Ellen van der Zweep. Elle est l'une des meilleurs dresseurs de chiens au monde,",False,375089,1445
2722,2875,et elle pense que nous pouvons faire beaucoup plus.,False,378803,1445
2723,3718,Étant donné que nous savons aussi que les gens  porteurs des parasites du paludisme,False,381678,1445
2724,2976,"ont une odeur différente de celle des gens qui ne sont pas infectés,",False,385396,1445
2725,2306,elle est convaincue  que nous pouvons dresser des chiens,False,388372,1445
2726,3690,à trouver les gens qui portent le parasite.,False,390678,1445
2727,2183,Ça signifie que dans une population où le paludisme,False,394368,1445
2728,3893,"où le paludisme a bien reculé, et où il reste peu de  gens porteurs des parasites,",False,396551,1445
2729,1579,"que les chiens peuvent trouver ces personnes,",False,400444,1445
2730,4239,nous pouvons les traiter avec des médicaments antipaludiques et donner le coup de grâce au le paludisme.,False,402023,1445
2731,3508,Le meilleur ami de l'homme  dans la lutte contre le paludisme.,False,406262,1445
2732,3038,"Ma troisième histoire est peut-être  encore plus remarquable,",True,409770,1445
2733,4849,"et, je dois le dire, n'a jamais été montrée au public  jusqu'à aujourd'hui.",False,412808,1445
2734,2070,Oui.,False,417657,1445
2735,3206,"C'est une histoire de folie, mais je crois  que c'est peut-être la vengeance ultime",False,419727,1445
2736,3319,et la meilleure contre les moustiques.,False,422933,1445
2737,3174,"En fait, des gens m'ont dit que maintenant ils vont aimer",False,426252,1445
2738,3062,se faire piquer par des moustiques.,False,429426,1445
2739,2708,"Et la question est bien sûr, qu'est-ce  qui rendrait une personne",False,432488,1445
2740,2610,heureuse de se faire piquer par des moustiques .,False,435196,1445
2741,1260,Et la réponse,False,437806,1445
2742,4117,"est ici dans ma poche,",False,439066,1445
2743,2710,si j'arrive à l’attraper.,False,443183,1445
2744,3346,"C'est un comprimé, un simple comprimé,",False,445893,1445
2745,2882,"et quand je le prendre avec de l'eau,",False,449239,1445
2746,4275,il fait des miracles.,False,452121,1445
2747,1673,Merci.,False,456396,1445
2749,4016,"Maintenant, permettez-moi de vous montrer  comment ça fonctionne.",True,464029,1445
2750,3017,"Ici, dans cette boîte, j'ai une cage",False,468045,1445
2751,4794,avec plusieurs centaines,False,471062,1445
2752,4467,de moustiques femelles affamées,False,475856,1445
2753,3888,que je suis sur le point de lâcher. ,False,480323,1445
2754,3120,"Je plaisante, je plaisante.",False,484211,1445
2755,2892,"Ce que je vais vous montrer, je vais mettre mon bras dedans",False,487331,1445
2756,2715,et je vais vous montrer  comme elles piquent vite.,False,490223,1445
2757,1997,C'est parti.,False,492938,1445
2758,3422,"Ne vous inquiétez pas,  je fais ça tout le temps dans le laboratoire.",False,494935,1445
2759,3802,Voilà. Bon.,False,498357,1445
2760,5043,"Maintenant, sur la vidéo, la vidéo ici,",False,502159,1445
2761,1368,"je vais vous montrer exactement la même chose,",False,507202,1445
2762,2759,sauf que ce que je vous montre sur la vidéo,False,508570,1445
2763,3566,s'est passé une heure après avoir pris le comprimé.,False,511329,1445
2764,4724,Regardez. Ça ne marche pas. Bon. Désolé.,False,514895,1445
2765,2399,"Je mets mon bras bras, je leur donne  un bon repas de sang bien juteux,",False,519619,1445
2766,2268,"Je les secoue pour les faire partir,  et nous les suivons dans le temps",False,522018,1445
2767,3017,"pour voir que ces moustiques deviennent en effet très malades,",False,524286,1445
2768,2159,"montré ici en version accéléré,",False,527303,1445
2769,3364,et trois heures plus tard ce que nous voyons au fond,False,529462,1445
2770,3084,"de la cage ce sont des moustiques morts,",False,532826,1445
2771,4331,"tout à fait morts, et je vais dire, Mesdames et Messieurs,",False,535910,1445
2772,1865,que nous avons échangé les cartes  avec les moustiques.,False,540241,1445
2773,4720,Ils ne nous tuent pas. Nous les tuons.,False,542106,1445
2775,6084,"Maintenant ,  —",True,554983,1445
2776,1838,"Maastricht, soyez prêts.",False,561067,1445
2777,2126,Maintenant pensez à ce que nous pouvons faire avec ça.,False,562905,1445
2778,2198,Nous pouvons effectivement l'utiliser  pour contenir les épidémies,False,565031,1445
2779,3386,"de maladies transmises par les moustiques, d'épidémies, vous voyez .",False,567229,1445
2780,2017,"Et mieux encore, imaginez ce qui arriverait si,",False,570615,1445
2781,3059,"dans une zone très étendue, tout le monde  prenait ces médicaments,",False,572632,1445
2782,2261,"ce médicament, rien que pendant 3 semaines.",False,575691,1445
2783,2408,Ça nous donnerait la possibilité d'éliminer réellement,False,577952,1445
2784,1610,le paludisme en tant que maladie.,False,580360,1445
2785,4094,"Donc du fromage, les chiens et une pilule  pour tuer les moustiques.",True,581970,1445
2786,3638,"C'est le genre de science insolite que j'aime faire,",False,586064,1445
2787,2505,"pour améliorer l'humanité,",False,589702,1445
2788,2801,"mais surtout pour elle, pour qu'elle puisse grandir",False,592207,1445
2789,4800,dans un monde sans paludisme. Merci.  ,False,595008,1445
3195,3300,Les cris de la foule. Les rugissements d'un lion.,True,6998,44216
3196,1680,Le fracas du métal.,False,10298,44216
3197,5035,Tous ces bruits ont retenti dans le Colisée dès l'an 80 de notre ère.,False,11978,44216
3198,1503,"100 jours par an,",False,17013,44216
3199,4800,plus de 50 000 citoyens romains et visiteurs venus de tout l'Empire romain,False,18516,44216
3200,4298,"remplissaient les quatre étages du stade pour voir des duels de gladiateurs,",False,23316,44216
3201,3799,"des combats d'animaux, et des courses de chars dans l'arène.",False,27614,44216
3202,4339,"Pour le final, on déversait de l'eau dans le bassin de l'arène,",False,31413,44216
3203,3618,pour submerger la scène et créer le spectacle le plus grandiose .,False,35752,44216
3204,2780,des simulacres de combats navals.,False,39370,44216
3205,4292,"Les naumachies, d'épiques combats maritimes simulés de Rome,",False,42150,44216
3206,3967,"ont commencé sous le règne de Jules César au premier siècle avant Jésus-Christ,",False,46442,44216
3207,3614,100 ans avant la construction du Colisée.,False,50409,44216
3208,2915,Ils étaient organisés avec d'autres spectacles aquatiques,False,54023,44216
3209,3670,"sur des plans d'eau naturels ou artificiels autour de Rome,",False,56938,44216
3210,2551,jusqu'à ce que l'empereur Vespasien,False,60608,44216
3211,2860,"démarre les travaux de construction du Colisée en l'an 70,",False,63159,44216
3212,2130,sur le site d'un ancien lac.,False,66019,44216
3213,4104,Le Colisée devait devenir le symbole de la puissance de Rome dans le monde,False,68149,44216
