index,duration,content,startOfParagraph,startTime,ID
1838,3216,"Wie Pilze, die aus dem Beton  emporwachsen.",False,520617,1542
1839,6681,"Menschen verbinden sich miteinander,  wie Bundy gerade sagte, von überall,",False,523833,1542
1840,2273,um Wandel zu bringen.,False,530514,1542
1841,4266,"Peace Direct bemerkte recht früh,",True,532787,1542
1842,3551,dass die Menschen direkt in den extremen Konfliktzonen,False,537053,1542
1843,2436,"wissen, was zu tun ist.",False,540604,1542
1844,2216,Sie wissen das am besten.,False,543040,1542
1845,3282,Peace Direct stärkt ihnen  also dabei den Rücken.,False,545256,1542
1846,2199,Und sie tun zum Beispiel so was wie,False,548538,1542
1847,3168,"Milizen zu demobilisieren,",False,550737,1542
1848,2603,"Wirtschaften wieder aufzubauen,",False,553905,1542
1849,2350,Flüchtlinge wieder anzusiedeln,False,556508,1542
1850,5501,und sogar Kindersoldaten zu befreien.,False,558858,1542
1851,2866,Und fast täglich müssen sie dafür,False,564359,1542
1852,3219,ihre Leben riskieren.,False,567225,1542
1853,3814,"Und dabei haben sie erkannt,",False,570444,1542
1854,4933,dass der Einsatz von Gewalt  in solchen Situationen,False,574258,1542
1855,4519,"nicht nur weniger human ist,",False,579191,1542
1856,2135,sondern auch weniger effektiv,False,583710,1542
1857,6531,"als der Einsatz von Methoden,  die Menschen verbinden, die wieder aufbauen.",False,585845,1542
1858,3932,"Und ich glaube, die US-Armee",True,592376,1542
1859,6880,"beginnt langsam, das zu verstehen.",False,596308,1542
1860,2709,"Bis jetzt bestand  ihre Antiterrorismusstrategie darin,",False,603188,1542
1861,4833,"Aufständische um fast jeden Preis zu töten,",False,605897,1542
1862,3203,"und wenn Zivilisten in den Weg geraten,",False,610730,1542
1863,4266,ist das ein Kollateralschaden.,False,613933,1542
1864,6733,Und das erzürnt und demütigt,False,618199,1542
1865,2350,"die Bevölkerung Afghanistans so sehr,",False,624932,1542
1866,4348,"dass Rekrutierungen  für al-Qaida sehr leicht fallen,",False,627282,1542
1867,3170,weil Menschen von Aktionen wie etwa,False,631630,1542
1868,2379,einer Koranverbrennung  so abgestoßen sind.,False,634800,1542
1869,3001,Die Truppenausbildung  muss sich also ändern.,True,637179,1542
1870,5108,"Und ich denke, für diese Änderung  gibt es Anzeichen.",False,640180,1542
1871,2784,Das britische Militär ist dabei  immer viel besser gewesen.,False,645288,1542
1872,5682,"Aber von einem fantastischen Beispiel  sollten Sie sich leiten lassen,",False,648072,1542
1873,3168,nämlich von einem brillanten US-Offizier,False,653754,1542
1874,1665,namens Chris Hughes.,False,656922,1542
1875,4217,Er führte seine Männer  die Straßen von Najaf entlang –,False,658587,1542
1876,2168,das war im Irak –,False,662804,1542
1877,5033,"und plötzlich strömten aus den Häusern links und rechts Menschen,",False,664972,1542
1878,4598,die wütend schrien,False,670005,1542
1879,4468,"und diese jungen Soldaten umringten,  die wie versteinert da standen,",False,674603,1542
1880,2500,"keine Ahnung hatten, was los war, kein Arabisch sprachen.",False,679071,1542
1881,4250,"Und Chris Hughes lief genau  in die Mitte des Auflaufs,",False,681571,1542
1882,3869,"die Waffe hoch über dem Kopf,  zeigte er auf den Boden",False,685821,1542
1883,1698,und sagte. Hinknien.,False,689690,1542
1884,2800,Und diese riesigen Soldaten,False,691388,1542
1885,2633,mit ihren Rucksäcken und der Panzerung,False,694188,1542
1886,4474,taumelten zu Boden.,False,696821,1542
1887,6085,Völlige Stille breitete sich aus.,False,701295,1542
1888,2558,Und nach etwa zwei Minuten,False,707380,1542
1889,4276,bewegten sich alle zur Seite  und gingen nach Hause.,False,709938,1542
1890,5482,Und genau das ist Weisheit in Aktion.,True,714214,1542
1891,4166,In diesem Moment tat er das.,False,719696,1542
1892,5762,Und das passiert jetzt überall.,False,723862,1542
1893,1909,Sie glauben mir nicht.,False,729624,1542
1894,3659,"Haben Sie sich gefragt,",False,731533,1542
1895,4440,wieso so viele Diktaturen  in den letzten 30 Jahren,False,735192,1542
1896,3351,zusammengebrochen sind.,False,739632,1542
1897,5067,"Diktaturen in der Tschechoslowakei, der DDR,",False,742983,1542
1898,4215,"Estland, Lettland, Litauen,",False,748050,1542
1899,2886,"Mali, Madagaskar,",False,752265,1542
1900,3782,"Polen, den Philippinen,",False,755151,1542
1901,5083,"Serbien, Slowenien, ich könnte fortfahren.",False,758933,1542
1902,4590,Jetzt sind es Tunesien und Ägypten.,False,764016,1542
1903,4050,Das ist nicht einfach so passiert.,False,768606,1542
1904,3151,"Eine Menge davon liegt an einem Buch,",False,772656,1542
1905,4465,das ein 80-Jähriger in Boston schrieb. Gene Sharp.,False,775807,1542
1906,4017,Er schrieb ein Buch namens  Von der Diktatur zur Demokratie,False,780272,1542
1907,5396,mit 81 Vorgehensweisen  zum gewaltfreien Widerstand.,False,784289,1542
1908,2087,Und es ist in  26 Sprachen übersetzt worden.,False,789685,1542
1909,2084,Es ist um die Welt geflogen.,False,791772,1542
1910,7187,"Und es wird von Jungen  und Alten überall verwendet,",False,793856,1542
1911,5422,weil es funktioniert und weil es effektiv ist.,False,801043,1542
1912,4558,Das gibt mir also Hoffnung –,True,806465,1542
1913,3753,"nicht nur Hoffnung, das lässt  mich gerade sehr gut fühlen.",False,811023,1542
1914,4016,Denn endlich beginnen  die Menschen es zu verstehen.,False,814776,1542
1915,7618,"Wir haben langsam tatsächlich machbare Strategien,",False,818792,1542
1916,1584,die meine Frage beantworten können.,False,826410,1542
1917,6302,"Wie können wir mit dem Peiniger umgehen,  ohne selbst zum Verbrecher zu werden.",False,827994,1542
1918,4410,Wir verwenden die eingangs erwähnten Fertigkeiten.,False,834296,1542
1919,3718,"die Entwicklung innerer Kraft  durch Selbst-Erkenntnis,",False,838706,1542
1920,3566,"das Erkennen und Arbeiten  mit unserer Angst,",False,842424,1542
1921,3518,"Angst als Brennstoff verwenden,",False,845990,1542
1922,2565,"Kooperation mit anderen,",False,849508,1542
1923,1935,"Vernetzung mit anderen,",False,852073,1542
1924,2182,"Mut,",False,854008,1542
1925,6969,"und am wichtigsten, der Einsatz  aktiver Gewaltfreiheit.",False,856190,1542
1926,4114,Ich glaube nicht einfach an Gewaltfreiheit.,True,863159,1542
1927,2935,Ich muss nicht daran glauben.,False,867273,1542
1928,3550,"Ich sehe überall den Beweis,  dass sie funktioniert.",False,870208,1542
1929,6050,"Und ich sehe, dass wir, normale Menschen,",False,873758,1542
1930,6318,"das tun können, was Aung San Suu Kyi  und Gandhi und Mandela taten.",False,879808,1542
1931,2723,"Wir können dem blutigsten Jahrhundert,",False,886126,1542
1932,4999,"das die Menschheit je sah, ein Ende setzen.",False,888849,1542
1933,7941,"Und wir können organisiert  die Unterdrückung überwinden,",False,893848,1542
1934,2618,"indem wir unsere Herzen öffnen,",False,901789,1542
1935,5850,und zugleich auch diesen  unglaublichen Entschluss stärken.,False,904407,1542
1936,4600,"Und diese offenen Herzen  spiegeln genau das wider,",True,910257,1542
1937,4434,"was ich in dieser Organisation hier  erlebt habe, seitdem ich gestern ankam.",False,914857,1542
1938,2121,Danke.,False,919291,1542
1940,3000,"Es ist also 1995,",True,0,1126
1941,2000,ich bin an der Universität,False,3000,1126
1942,3000,und eine Freundin und ich starten einen Roadtrip,False,5000,1126
1943,2000,"von Providence, Rhode Island,",False,8000,1126
1944,2000,"nach Portland, Oregon.",False,10000,1126
1945,3000,"Und wissen Sie, wir sind jung und arbeitslos,",False,12000,1126
1946,2000,"deswegen fahren wir die ganze Strecke über Nebenstraßen,",False,15000,1126
1947,2000,durch Naturschutzgebiete,False,17000,1126
1948,3000,und Nationalparks –,False,19000,1126
1949,3000,"im Grunde genommen die längste mögliche Route, die man überhaupt nehmen kann.",False,22000,1126
1950,3000,Und irgendwo in der Mitte von South Dakota,False,26000,1126
1951,3000,wende ich mich zu meiner Freundin,False,29000,1126
1952,2000,"und stelle ihr eine Frage,",False,32000,1126
1953,2000,die mich schon,False,34000,1126
1954,3000,2.000 Meilen lang beschäftigt hat.,False,36000,1126
1955,4000,"„Was soll das chinesische Schriftzeichen bedeuten, das ich andauernd am Straßenrand sehe.",False,40000,1126
1956,4000,Meine Freundin sieht mich vollkommen verständnislos an.,False,47000,1126
1957,2000,"Da ist übrigens ein Herr in der ersten Reihe,",False,51000,1126
1958,3000,der ihren Gesichtsausdruck perfekt imitiert.,False,53000,1126
1960,2000,"Und ich so. „Du weißt schon,",False,59000,1126
1961,2000,"all die Schilder, die wir andauernd sehen,",False,61000,1126
1962,3000,mit dem chinesischen Schriftzeichen drauf.,False,63000,1126
1963,3000,Sie starrt mich ein paar Sekunden lang bloß an,False,67000,1126
1964,3000,"und dann bricht es aus ihr heraus,",False,70000,1126
1965,2000,"weil sie kapiert hat, wovon ich spreche.",False,73000,1126
1966,3000,"Und was ich meinte, ist Folgendes.",False,75000,1126
1968,4000,"Richtig, das berühmte chinesische Schriftzeichen für Rastplatz.",False,84000,1126
1970,4000,"Ich habe die letzten fünf Jahre meines Lebens damit verbracht,",True,90000,1126
1971,2000,"über Situationen nachzudenken,",False,94000,1126
1972,3000,genau wie diese –,False,96000,1126
1973,2000,warum wir manchmal die Zeichen,False,99000,1126
1974,2000,"um uns herum missverstehen,",False,101000,1126
1975,3000,"und wie wir uns verhalten, wenn es passiert",False,103000,1126
1976,4000,und was all das uns über die menschliche Natur verraten kann.,False,106000,1126
1977,2000,"Mit anderen Worten, so wie es Chris gesagt hat,",False,110000,1126
1978,2000,"ich habe die fünf Jahre damit verbracht,",False,112000,1126
1979,3000,über das Irren nachzudenken.,False,114000,1126
1980,3000,"Dies mag Ihnen als Karrierewahl merkwürdig erscheinen,",False,117000,1126
1981,3000,aber es hat in der Tat einen großen Vorteil.,False,120000,1126
1982,2000,keine Konkurrenz.,False,123000,1126
1984,3000,"Tatsächlich tun die meisten von uns alles Mögliche,",False,127000,1126
1985,3000,"um zu vermeiden, über das Irren nachzudenken,",False,130000,1126
1986,2000,"oder wenigstens um zu vermeiden, über die Möglichkeit nachzudenken,",False,133000,1126
1987,2000,dass wir selbst uns irren.,False,135000,1126
1988,2000,Wir verstehen das auf einer abstrakten Ebene.,False,137000,1126
1989,2000,"Wir alle wissen, dass jeder in diesem Raum Fehler macht.",False,139000,1126
1990,3000,"Die menschliche Spezies ist grundsätzlich fehlbar – so weit, so gut.",False,142000,1126
1991,3000,"Aber wenn es speziell um mich geht,",True,146000,1126
1992,2000,"um alles, woran ich glaube,",False,149000,1126
1993,3000,"hier in der Gegenwart,",False,151000,1126
1994,4000,ist plötzlich all diese abstrakte Anerkennung der Fehlbarkeit,False,154000,1126
1995,3000,für die Katz –,False,158000,1126
1996,3000,"und mir fällt einfach nichts ein, bei dem ich mich irren könnte.",False,161000,1126
1997,3000,"Und die Sache ist die, wir leben in der Gegenwart.",False,165000,1126
1998,3000,"Wir gehen zu Besprechungen in der Gegenwart,",False,168000,1126
1999,2000,"wir machen Familienurlaub in der Gegenwart,",False,171000,1126
2000,4000,wir gehen zur Wahl und geben unsere Stimme ab in der Gegenwart.,False,173000,1126
2001,3000,"Alles in allem ist es so, dass wir durchs Leben gehen,",False,177000,1126
2002,2000,gefangen in dieser kleinen Blase,False,180000,1126
2003,3000,"der Gewissheit, bei allem recht zu haben.",False,182000,1126
2004,2000,"Ich denke, das ist ein Problem.",True,186000,1126
2005,3000,"Ich denke, das ist ein Problem für jeden von uns als Individuum,",False,188000,1126
2006,3000,"in unserem Privat- und Berufsleben,",False,191000,1126
2007,3000,"und ich denke, das ist ein kollektives Problem für uns alle als Kultur.",False,194000,1126
2008,2000,"Was ich heute also tun möchte,",False,197000,1126
2009,3000,"ist zu allererst, darüber zu sprechen, warum wir",False,199000,1126
2010,2000,"in dem Gefühl gefangen sind, recht zu haben.",False,202000,1126
2011,3000,"Und zweitens, warum das so ein Problem ist.",False,204000,1126
2012,2000,"Und schließlich möchte ich Sie überzeugen,",False,207000,1126
2013,2000,dass es möglich ist,False,209000,1126
2014,2000,"dieses Gefühl hinter sich zu lassen,",False,211000,1126
2015,2000,"und dass dies, wenn Sie es können,",False,213000,1126
2016,2000,"der größte moralische, intellektuelle und",False,215000,1126
2017,3000,"kreative Sprung ist, den Sie machen können.",False,217000,1126
2018,2000,"Warum also sind wir in dem Gefühl gefangen,",True,222000,1126
2019,2000,recht zu haben.,False,224000,1126
2020,3000,"Ein Grund hat tatsächlich etwas mit dem Gefühl zu tun, sich zu irren.",False,226000,1126
2021,2000,"Nun, lassen Sie mich etwas fragen –",False,229000,1126
2022,4000,"oder lassen Sie mich die Frage an Sie richten, weil Sie direkt hier sitzen.",False,231000,1126
2023,3000,Wie fühlt es sich an – emotional gesehen –,False,235000,1126
2024,3000,"wie fühlt es sich an, sich zu irren.",False,238000,1126
2025,3000,Fürchterlich. Daumen runter.,False,241000,1126
2026,2000,"Peinlich. Okay, wunderbar, gut.",False,244000,1126
2027,2000,"Fürchterlich, Daumen runter, peinlich –",False,246000,1126
2028,3000,"danke, das sind großartige Antworten,",False,248000,1126
2029,3000,aber es sind Antworten auf eine andere Frage.,False,251000,1126
2030,2000,Sie beantworten die Frage.,False,254000,1126
2031,3000,"Wie fühlt es sich an, festzustellen, dass man sich irrt.",False,256000,1126
2033,3000,"Festzustellen, dass man sich irrt, kann sich genau so und noch ganz anders anfühlen, richtig.",False,263000,1126
2034,3000,"Ich meine, es kann verheerend sein, es kann aufschlussreich sein,",False,266000,1126
2035,2000,"es kann tatsächlich sehr lustig sein,",False,269000,1126
2036,3000,wie mein dummer Irrtum mit dem chinesischen Schriftzeichen.,False,271000,1126
2037,3000,"Aber sich bloß zu irren,",False,274000,1126
2038,2000,fühlt sich nach gar nichts an.,False,277000,1126
2039,3000,Ich zeige Ihnen eine Analogie.,True,279000,1126
2040,2000,"Erinnern Sie sich an den Cartoon „Loony Tunes,",False,282000,1126
2041,2000,"mit diesem Mitleid erregenden Kojoten,",False,284000,1126
2042,2000,der immer den Rennkuckuck jagt und ihn niemals fängt.,False,286000,1126
2043,3000,In so ziemlich jeder Folge von diesem Cartoon,False,288000,1126
2044,2000,"gibt es den Moment, in dem der Kojote den Rennkuckuck jagt",False,291000,1126
2045,2000,"und der Rennkuckuck über eine Klippe rennt,",False,293000,1126
2046,3000,"was okay ist, denn er ist ein Vogel, er kann fliegen.",False,295000,1126
2047,4000,"Doch die Sache ist, der Kojote rennt gleich nach ihm über die Klippe.",False,298000,1126
2048,2000,Und was daran lustig ist –,False,302000,1126
2049,2000,zumindest wenn man sechs Jahre alt ist –,False,304000,1126
2050,2000,"ist, dass das für den Kojoten auch völlig in Ordnung ist.",False,306000,1126
2051,2000,Er rennt einfach weiter –,False,308000,1126
2052,2000,"genau bis zu dem Moment, in dem er nach unten schaut",False,310000,1126
2053,3000,"und realisiert, dass er in der Luft schwebt.",False,312000,1126
2054,3000,"Das ist der Moment, in dem er fällt.",False,315000,1126
2055,2000,Wenn wir uns bei etwas irren –,False,319000,1126
2056,3000,"nicht dann, wenn wir es realisieren, sondern davor –",False,321000,1126
2057,3000,"sind wir wie der Kojote,",False,324000,1126
2058,3000,nachdem er über die Klippe gerannt ist und bevor er herunterschaut.,False,327000,1126
2059,3000,"Wissen Sie, wir irren uns schon,",False,331000,1126
2060,2000,"wir stecken bereits in Schwierigkeiten,",False,334000,1126
2061,3000,"aber wir denken, wir befinden uns auf festem Boden.",False,336000,1126
2062,3000,"Ich sollte also etwas korrigieren, was ich gerade eben gesagt habe.",False,340000,1126
2063,3000,"Es fühlt sich an wie etwas, wenn wir uns irren,",False,343000,1126
2064,3000,"es fühlt sich an, als ob wir recht hätten.",False,346000,1126
2066,3000,"Dies ist also ein Grund, ein struktureller Grund,",True,352000,1126
2067,2000,"warum wir in dem Gefühl, recht zu haben, gefangen sind.",False,355000,1126
2068,2000,Ich nenne dies Fehlerblindheit.,False,357000,1126
2069,2000,Die meiste Zeit,False,359000,1126
2070,3000,"verfügen wir nicht über einen internen Fingerzeig,",False,361000,1126
2071,2000,"der uns darauf hinweist, dass wir uns bei einer Sache irren,",False,364000,1126
2072,3000,bis es zu spät ist.,False,366000,1126
2073,3000,"Aber es gibt noch einen zweiten Grund, warum wir in diesem Gefühl gefangen sind –",False,369000,1126
2074,2000,und dieser ist kulturell.,False,372000,1126
2075,3000,Denken Sie kurz an die Grundschule zurück.,False,375000,1126
2076,2000,"Sie sitzen dort in der Klasse,",False,378000,1126
2077,3000,und Ihre Lehrerin gibt Testbögen zurück,False,380000,1126
2078,2000,und einer davon sieht aus wie dieser.,False,383000,1126
2079,2000,Das ist übrigens nicht meiner.,False,385000,1126
2081,3000,"Sie sind also in der Grundschule,",False,389000,1126
2082,2000,"und Sie wissen genau, was sie von",False,392000,1126
2083,3000,"dem Kind halten sollen, das diesen Bogen bekommt.",False,394000,1126
2084,3000,"Das ist das dumme Kind, das Ärger macht,",False,397000,1126
2085,3000,"eines, das nie seine Hausaufgaben macht.",False,400000,1126
2086,3000,"Und wenn Sie neun Jahre alt sind,",False,403000,1126
2087,2000,"haben Sie erstens schon gelernt,",False,406000,1126
2088,2000,"dass Menschen, die Sachen falsch machen,",False,408000,1126
2089,3000,"faule, verantwortungslose Dummköpfe sind –",False,410000,1126
2090,2000,"und zweitens,",False,413000,1126
2091,2000,"dass man im Leben erfolgreich ist,",False,415000,1126
2092,3000,wenn man keine Fehler macht.,False,417000,1126
2093,4000,Wir lernen diese wirklich schlechte Lektion wirklich gut.,True,421000,1126
2094,2000,Und viele von uns –,False,426000,1126
2095,4000,"und ich vermute, besonders viele von uns in diesem Raum –",False,428000,1126
2096,2000,"reagieren darauf, indem sie einfach",False,432000,1126
2097,2000,"kleine perfekte Einser-Schüler werden,",False,434000,1126
2098,3000,"Perfektionisten, Overachiever.",False,436000,1126
2099,2000,"Nicht wahr,",False,439000,1126
2100,4000,"Mr. CFO, Astrophysiker, Ultra-Marathonläufer.",False,441000,1126
2102,4000,"Scheinbar sind Sie alle CFOs, Astrophysiker, Ultra-Marathonläufer.",False,452000,1126
2103,2000,Das ist okay.,False,456000,1126
2104,3000,"Außer, dass wir dann ausflippen",False,458000,1126
2105,2000,"bei der Möglichkeit, uns bei etwas geirrt zu haben.",False,461000,1126
2106,3000,Denn gemäß dem hier,False,463000,1126
2107,2000,"bedeutet, wenn man etwas falsch macht,",False,466000,1126
2108,3000,dass etwas mit uns falsch ist.,False,468000,1126
2109,2000,"Wir bestehen also darauf, dass wir recht haben,",False,471000,1126
2110,2000,"weil es uns das Gefühl gibt, smart und verantwortlich",False,473000,1126
2111,3000,und talentiert und auf der sicheren Seite zu sein.,False,475000,1126
2112,2000,Ich möchte Ihnen eine Geschichte erzählen.,True,479000,1126
2113,2000,Vor ein paar Jahren,False,481000,1126
2114,3000,kam eine Frau für eine Operation ins Beth Israel Deaconess-Krankenhaus.,False,483000,1126
2115,2000,"Beth Israel ist in Boston,",False,486000,1126
2116,2000,Es ist die Universitätsklinik von Harvard –,False,488000,1126
2117,2000,eines der besten Krankenhäuser des Landes.,False,490000,1126
2118,3000,Die Frau kommt also an und wird in den OP gebracht.,False,492000,1126
2119,2000,Sie wird narkotisiert und der Chirurg macht seine Sache –,False,495000,1126
2120,3000,"näht sie wieder zu, schickt sie in den Aufwachraum.",False,497000,1126
2121,3000,Alles scheint gut gelaufen zu sein.,False,500000,1126
2122,3000,Und sie wacht auf und sie schaut an sich herunter,False,503000,1126
2123,4000,und sie sagt. „Warum ist die falsche Seite meines Körper verbunden.,False,506000,1126
2124,3000,"Nun, die falsche Seite ihres Körpers ist verbunden,",False,510000,1126
2125,2000,weil der Chirurg eine große Operation,False,513000,1126
2126,3000,"an ihrem linken, anstatt an ihrem rechten Bein durchgeführt hat.",False,515000,1126
2127,3000,Als der Vize-Direktor für die Qualität der Gesundheitspflege im Beth Israel,False,519000,1126
2128,3000,"über diesen Vorfall sprach,",False,522000,1126
2129,3000,sagte er etwas sehr Interessantes.,False,525000,1126
2130,3000,"Er sagte. „Warum auch immer,",False,528000,1126
2131,2000,"der Chirurg dachte einfach,",False,531000,1126
2132,2000,auf der richtigen Seite der Patientin zu sein.,False,533000,1126
2134,2000,"Der Punkt hier ist,",False,540000,1126
2135,3000,"dass zu viel Vertrauen auf das Gefühl,",False,542000,1126
2136,3000,"auf der richtigen Seite von irgendetwas zu sein,",False,545000,1126
2137,3000,sehr gefährlich sein kann.,False,548000,1126
2138,3000,"Dieses innere Gefühl der Richtigkeit,",True,551000,1126
2139,2000,"das wir alle so oft erleben,",False,554000,1126
2140,2000,"ist keine verlässliche Referenz,",False,556000,1126
2141,3000,"für das, was tatsächlich in der externen Welt vor sich geht.",False,558000,1126
2142,2000,"Und wenn wir so tun, als ob es das wäre",False,561000,1126
2143,4000,"und aufhören, die Möglichkeit in Betracht zu ziehen, dass wir uns irren könnten,",False,563000,1126
2144,2000,"nun, dann endet es damit, dass wir Dinge tun,",False,567000,1126
2145,4000,"wie 200 Millionen Gallonen Öl im Golf von Mexiko zu versenken,",False,569000,1126
2146,3000,oder die Weltwirtschaft zu torpedieren.,False,573000,1126
2147,3000,Dies ist also ein großes praktisches Problem.,False,577000,1126
2148,3000,Es ist aber auch ein großes soziales Problem.,False,580000,1126
2149,4000,"Denken Sie für einen Moment daran, wie es ist, sich im Recht zu fühlen.",True,583000,1126
2150,2000,"Es bedeutet, dass Sie denken, dass Ihre Überzeugungen",False,587000,1126
2151,3000,einfach perfekt die Realität widerspiegeln.,False,589000,1126
2152,2000,"Und wenn Sie so fühlen,",False,592000,1126
2153,2000,"stehen Sie vor einem großen Problem,",False,594000,1126
2154,2000,"das da wäre. Wie können Sie sich all die Leute erklären,",False,596000,1126
2155,3000,die nicht Ihrer Meinung sind.,False,598000,1126
2156,3000,"Es ist so, die meisten von uns erklären sich diese Leute auf die gleiche Weise,",False,601000,1126
2157,3000,indem sie auf eine Reihe von unglücklichen Annahmen zurückgreifen.,False,604000,1126
2158,3000,"Das erste, was wir machen, wenn man uns nicht zustimmt,",False,608000,1126
2159,3000,"ist anzunehmen, dass diejenigen ignorant sind.",False,611000,1126
2160,2000,Sie haben keinen Zugriff auf dieselben Informationen wie wir,False,614000,1126
2161,3000,"und wenn wir diese Informationen großzügig mit ihnen teilen,",False,616000,1126
2162,3000,werden sie das Licht am Ende des Tunnels erblicken und auf unsere Seite wechseln.,False,619000,1126
2163,3000,"Wenn das nicht funktioniert,",False,622000,1126
2164,2000,"wenn sich herausstellt, die Leute haben die gleichen Fakten wie wir",False,625000,1126
2165,2000,"und sie stimmen uns immer noch nicht zu,",False,627000,1126
2166,2000,"dann gehen wir über zu einer zweiten Annahme,",False,629000,1126
2167,2000,"die lautet, dass sie Idioten sind.",False,631000,1126
2169,2000,Sie haben alle passenden Puzzlestücke,False,635000,1126
2170,3000,"und sie sind geistig nicht dazu in der Lage, sie korrekt zusammenzusetzen.",False,637000,1126
2171,2000,"Und wenn das nicht funktioniert,",False,640000,1126
2172,3000,"wenn sich herausstellt, dass Leute, die uns nicht zustimmen,",False,642000,1126
2173,2000,die gleichen Fakten haben wie wir,False,645000,1126
2174,3000,"und auch noch ziemlich klug sind,",False,647000,1126
2175,3000,dann gehen wir über zu einer dritten Annahme.,False,650000,1126
2176,3000,Sie kennen die Wahrheit,False,653000,1126
2177,2000,und sie verzerren sie absichtlich,False,656000,1126
2178,3000,für ihre eigenen bösartigen Absichten.,False,658000,1126
2179,2000,Das ist eine Katastrophe.,False,662000,1126
2180,3000,Diese Treue zu unserer eigenen Richtigkeit,True,664000,1126
2181,2000,"hält uns davon ab, Fehler zu vermeiden,",False,667000,1126
2182,2000,wenn es wirklich notwendig ist,False,669000,1126
2183,3000,"und bringt uns dazu, einander schrecklich zu behandeln.",False,671000,1126
2184,2000,Was aber für mich das Erstaunlichste,False,675000,1126
2185,3000,"und Tragischste daran ist,",False,677000,1126
2186,4000,"ist, dass es den Kern des Menschseins nicht gerecht wird.",False,680000,1126
2187,2000,"Es ist, als ob wir uns vorstellen wollen,",False,684000,1126
2188,3000,dass unser Geist ein absolut durchsichtiges Fenster ist,False,686000,1126
2189,2000,und wir einfach hindurch nach draußen sehen,False,689000,1126
2190,3000,"und die Welt beschreiben, wie sie sich vor uns entfaltet.",False,691000,1126
2191,2000,"Und wir wollen, dass alle anderen auch durch dieses gleiche Fenster schauen",False,694000,1126
2192,2000,und exakt die gleiche Sache sehen.,False,696000,1126
2193,2000,Dem ist aber nicht so,False,698000,1126
2194,3000,"und wenn es so wäre, dann wäre das Leben unglaublich langweilig.",False,700000,1126
2195,3000,Das Wunder Ihres Geists,False,703000,1126
2196,3000,"ist nicht, dass Sie die Welt sehen können, wie sie ist.",False,706000,1126
2197,3000,"Es ist, dass Sie die Welt sehen können, wie sie nicht ist.",False,710000,1126
2198,2000,Wir können uns an die Vergangenheit erinnern,False,714000,1126
2199,3000,und wir können über die Zukunft nachdenken,False,716000,1126
2200,2000,"und wir können uns vorstellen, wie es ist,",False,719000,1126
2201,3000,eine andere Person an einem anderen Ort zu sein.,False,721000,1126
2202,2000,Und wir alle machen das ein wenig anders,False,724000,1126
2203,2000,und deswegen können wir alle in den gleichen Nachthimmel schauen,False,726000,1126
2204,2000,und dies sehen,False,728000,1126
2205,2000,und auch das,False,730000,1126
