index,duration,content,startOfParagraph,startTime,ID
272,1620,Als mein erstes Kinderbuch,True,880,2062
273,1763,"2001 veröffentlicht wurde,",False,2500,2062
274,2243,"kehrte ich an meine  frühere Grundschule zurück,",False,4263,2062
275,1940,um den Schülern von meinem Leben,False,6506,2062
276,1716,als Autor und Zeichner zu erzählen.,False,8446,2062
277,2733,Als ich meinen Projektor,False,10162,2062
278,3205,"im Speisesaal aufbaute,",False,12895,2062
279,2048,schaute ich mich um,False,16100,2062
280,2611,und erblickte sie.,False,18148,2062
281,1844,meine frühere Schulköchin.,False,20759,2062
282,1967,Sie arbeitete immer noch an der Schule,False,22603,2062
283,2886,und bereitete ganz eifrig  das Mittagessen vor.,False,24570,2062
284,1744,Ich ging auf sie zu und sagte.,False,27456,2062
285,1927,Hallo Jeannie. Wie geht's.,False,29200,2062
286,1430,"Sie sah mich an und ich sah,",False,31127,2062
287,1727,"dass sie mich erkannte,",False,32557,2062
288,3085,aber sie konnte mich nicht  gleich zuordnen. Dann sagte sie.,True,34284,2062
289,2511,Stephen Krosoczka.,False,37369,2062
290,2502,"Unglaublich. Sie wusste, dass ich ein Krosoczka war,",False,39880,2062
291,3321,aber Stephen ist mein 20 Jahre älterer Onkel,False,42382,2062
292,3137,"und sie war seine Schulköchin, als er noch ein Kind war.",False,45703,2062
293,2505,"Sie fing an, von ihren  Enkelkindern zu erzählen,",False,48840,2062
294,2705,und das hat mich umgehauen.,False,51345,2062
295,1794,"Meine Schulköchin hatte Enkelkinder,",False,54050,2062
296,964,"also auch Kinder,",False,55844,2062
297,3255,"was wiederum bedeutete, dass sie abends die Schule verließ.",False,56808,2062
298,2673,"Ich dachte, sie wohnt mit  den Löffeln in der Schulküche.",False,60063,2062
299,1886,Darüber hatte ich nie nachgedacht.,False,62736,2062
300,3732,"Diese zufällige Begegnung hat mich dazu inspiriert,",True,64622,2062
301,3551,"die Comicserie Lunch Lady zu entwerfen,",False,68354,2062
302,2177,"die von Schulköchinnen handelt,",False,71905,2062
303,2598,die mit ihren Fischstäbchen-Nunchakus,False,74082,2062
304,2902,"böse Cyborgs,",False,76680,2062
305,3127,"ein Schulbus-Monster und mutierte Mathegenies bekämpfen,",False,79582,2062
306,1827,und am Ende des Buches den Bösewicht,False,82709,2062
307,1326,mit ihrem Haarnetz fangen,False,84536,2062
308,3754,und verkünden. Der Feind ist abserviert.,False,85862,2062
310,2607,"Es ist verblüffend,",True,93869,2062
311,2893,wie gern Kinder die Serie lesen.,False,96476,2062
312,2239,"Sie schickten mir die unglaublichsten Briefe,",False,99369,2062
313,2157,Karten und Kunstwerke.,False,101608,2062
314,2474,"Bei meinen späteren  Schulbesuchen fiel mir auf,",False,103765,2062
315,2734,"dass das Küchenpersonal in die Planung einbezogen wurde,",False,106239,2062
316,1966,und zwar auf relevante Art und Weise.,False,108973,2062
317,1746,Quer durchs ganze Land,False,110939,2062
318,2315,haben mir alle Schulköchinnen das Gleiche gesagt.,False,112685,2062
319,3675,"Danke, dass Sie eine von uns zur Superheldin gemacht haben.",False,115000,2062
320,3689,Die Essensfrau wurde in der Popkultur der vergangenen Jahre,False,118675,2062
321,2602,nicht besonders nett behandelt.,False,122364,2062
322,2052,Aber Jeannie hat es sehr viel bedeutet.,False,124966,2062
323,1810,"Als die Bücher veröffentlicht wurden,",False,127018,2062
324,2104,habe ich sie zur Feier eingeladen.,False,128828,2062
325,1621,"Vor allen Anwesenden,",False,130932,2062
326,1607,"die sie jahrelang bedient hatte,",False,132553,2062
327,2820,überreichte ich ihr eine Zeichnung und einige Bücher.,False,134160,2062
328,2569,Zwei Jahre nach der Aufnahme dieses Fotos,False,136980,2062
329,1811,ging sie von uns.,False,139549,2062
330,1087,Bei ihrer Aufbahrung,False,141360,2062
331,2839,sah ich etwas völlig Unerwartetes.,False,142447,2062
332,3488,"Neben ihrem Sarg stand dieses Bild,",False,145286,2062
333,3566,"und ihr Ehemann sagte mir, es hätte ihr sehr viel bedeutet,",False,148774,2062
334,2418,dass ich ihre harte Arbeit anerkannt,False,152340,2062
335,2866,und ihre Tätigkeit gewürdigt hatte.,False,154758,2062
336,2302,"Das inspirierte mich zu einem Gedenktag,",True,157624,2062
337,1510,um dieses Gefühl,False,159926,2062
338,2645,in den Schulküchen im ganzen Land  aufleben zu lassen.,False,161436,2062
339,1823,"Den Tag der Helden der Schulküche,",False,164081,2062
340,3388,"an dem Kinder sich kreative Projekte für das Küchenpersonal ausdenken,",False,165904,2062
341,2504,in Zusammenarbeit mit dem Verband für Schulernährung.,False,169292,2062
342,2828,"Wussten Sie, dass  etwas über 30 Millionen Kinder",False,171796,2062
343,1822,täglich in der Schule essen.,False,174624,2062
344,3352,Das sind etwas über 5 Milliarden zubereitete Mahlzeiten,False,176446,2062
345,1507,pro Schuljahr.,False,179798,2062
346,2386,"Doch die Heldentaten enden nicht bei einem Kind,",True,181305,2062
347,1837,das ein paar Extrastücke Hühnernuggets,False,183691,2062
348,1315,auf sein Tablett bekommt.,False,185528,2062
349,1709,"Das ist Frau Brenda in Kalifornien,",False,186843,2062
350,2789,"die jeden Schüler im Auge behält, der sich bei ihr anstellt",False,188552,2062
351,2485,"und dann einem Vertrauenslehrer berichtet,",False,191341,2062
352,1350,wenn etwas nicht stimmt.,False,193826,2062
353,1674,"Es gibt Schulköchinnen in Kentucky,",False,195176,2062
354,2385,"denen klar wurde, dass 67  percent ihrer Schüler",False,196850,2062
355,1973,täglich von diesen Mahlzeiten abhängen,False,199235,2062
356,1986,und im Sommer nichts zu essen haben.,False,201208,2062
357,2004,Sie rüsteten einen alten Schulbus,False,203194,2062
358,2074,für eine mobile Essensausgabe auf.,False,205198,2062
359,1659,Sie fuhren durch die Nachbarschaft,False,207272,2062
360,2523,und versorgten über den Sommer  täglich 500 Kinder.,False,208931,2062
361,2595,Die Kids dachten sich  die wunderbarsten Projekte aus.,True,211454,2062
362,730,Ich wusste es.,False,214049,2062
363,2042,Die Kinder bastelten aus buntem Karton,False,214779,2062
364,1564,Hamburger-Karten.,False,216821,2062
365,1981,"Sie fotografierten ihre Schulköchinnen,",False,218385,2062
366,2018,"klebten sie auf die Cartoon-Lunch Ladies,",False,220366,2062
367,1503,machten daraus Milchkartons,False,222384,2062
368,2486,und überreichten diese mit Blumen.,False,223887,2062
369,2003,"Sie malten auch ihre eigenen Comics,",False,226373,2062
370,1361,mit meiner Lunch Lady,False,228376,2062
371,2303,Seite an Seite mit  ihren eigenen Schulköchinnen.,False,229737,2062
372,1856,Sie machten auch Dankeschön-Pizzen,False,232040,2062
373,1915,und jedes Kind unterschrieb,False,233896,2062
374,2959,auf einem Belag der Papp-Pizza.,False,235811,2062
375,3600,"Was mich betrifft , ich war sehr gerührt von den Reaktionen",True,238770,2062
376,1979,der Schulköchinnen.,False,242370,2062
377,1879,Eine der Frauen sagte zu mir.,False,244349,2062
378,2535,Früher fühlte ich mich,False,246228,2062
379,2437,in dieser Schule wie am anderen Ende der Welt.,False,248763,2062
380,2375,"Ich dachte nicht,  dass uns hier jemand bemerkt.",False,251200,2062
381,1867,Eine andere Frau meinte.,False,253575,2062
382,2548,"Wissen Sie, was ich aus dieser Sache gelernt habe.",False,255442,2062
383,2954,"Dass das, was ich tue, wichtig ist.",False,257990,2062
384,2340,"Selbstverständlich ist es wichtig, was sie tut.",True,260944,2062
385,2104,"Was sie alle tun, ist wichtig.",False,263284,2062
386,3389,Sie versorgen unsere Kinder Tag für Tag mit Essen.,False,265388,2062
387,2459,"Bevor ein Kind lernen kann,",False,268777,2062
388,2530,"muss sein Bäuchlein voll sein,",False,271236,2062
389,1778,und diese Frauen und Männer,False,273766,2062
390,1923,arbeiten an vorderster Front,False,275544,2062
391,2203,für eine gebildete Gesellschaft.,False,277467,2062
392,2270,"Also hoffe ich,",True,279670,2062
393,2401,"dass Sie nicht auf den Heldentag warten,",False,281940,2062
394,2035,"um Ihrem Küchenpersonal zu danken,",False,284341,2062
395,2048,"und ich hoffe, Sie erinnern sich,",False,286376,2062
396,2846,wie viel Kraft in einem Dankeschön steckt.,False,288424,2062
397,1995,Ein Dankeschön kann ein Leben verändern.,False,291270,2062
398,3202,"Es verändert das Leben derer, die es empfangen,",False,293265,2062
399,2284,"und es verändert das Leben derer,",False,296467,2062
400,1626,die es ausdrücken.,False,298751,2062
401,2118,Danke schön.,True,300377,2062
403,2122,Wie viel verdienen Sie.,True,1068,2585
404,2583,Beantworten Sie das nicht laut.,False,3190,2585
405,2304,Aber stellen Sie sich eine Zahl vor.,False,5773,2585
406,4793,Nun. Was denken Sie verdient  die Person neben Ihnen.,False,8077,2585
407,1939,Antworten Sie nicht darauf.,False,13396,2585
409,2458,"Bei Ihrer Arbeit, was denken Sie,",True,17144,2585
410,3882,wie viel die Person auf dem Platz neben Ihnen bezahlt bekommt.,False,19602,2585
411,1665,Wissen Sie es.,False,23488,2585
412,1839,Sollten Sie es wissen.,False,25153,2585
413,4056,"Sehen Sie, es ist mir etwas unangenehm, Ihnen diese Fragen zu stellen.",True,26992,2585
414,3704,"Aber geben Sie zu, Sie  würden es gerne wissen.",False,31048,2585
415,3906,"Den meisten von uns ist die Vorstellung, unser Gehalt bekannt zu geben, unangenehm.",False,34752,2585
416,2423,Wir sollen es nicht  unseren Nachbarn erzählen,False,38658,2585
417,2820,und definitiv nicht  unseren Arbeitskollegen.,False,41081,2585
418,2648,"Es besteht die Annahme,  dass wenn alle wüssten,",False,43901,2585
419,2670,"wie viel jeder verdient,  die Hölle los wäre.",False,46549,2585
420,2019,"Es gäbe Diskussionen, Streitereien,",False,49219,2585
421,2409,manche würden vielleicht sogar kündigen.,False,51238,2585
422,3697,"Aber was, wenn Geheimhaltung der Grund für all das ist.",False,53647,2585
423,3125,"Was würde passieren, wenn wir die Geheimhaltung beseitigen.",False,57344,2585
424,4005,"Was, wenn Offenheit das Gefühl von Fairness und Zusammenarbeit",False,60469,2585
425,1502,in einer Firma erhöht.,False,64474,2585
426,3808,"Was würde passieren, wenn wir völlige Lohntransparenz hätten.",False,65976,2585
427,1377,In den letzten Jahren,True,70194,2585
428,2807,"habe ich Unternehmenschefs  und Führungskräfte untersucht,",False,71595,2585
429,3899,"die die gängige Meinung, wie man  ein Unternehmen führt, in Frage stellen.",False,74402,2585
430,2816,Das Thema Bezahlung kommt immer wieder auf.,False,78301,2585
431,2768,Die Antworten überraschen immer wieder.,False,81117,2585
432,2027,"Es stellt sich heraus, dass Lohntransparenz",True,84198,2585
433,2524,", Gehälter offen im  Unternehmen zu kommunizieren ,",False,86225,2585
434,2307,bessere Arbeitsbedingungen für die Angestellten,False,88749,2585
435,2016,und für das Unternehmen schafft.,False,91056,2585
436,3899,"Wenn Menschen nicht wissen, wie ihr Gehalt im Vergleich zu dem ihrer Kollegen ist,",False,93072,2585
437,1810,"tendieren sie dazu, sich unterbezahlt",False,96971,2585
438,2079,und manchmal sogar  diskriminiert zu fühlen.,False,98781,2585
439,2631,"Wollen Sie an einem Ort arbeiten, an dem geduldet wird,",False,100860,2585
440,3248,dass Sie sich unterbezahlt oder diskriminiert fühlen.,False,103491,2585
441,2482,Doch Gehälter geheim zu  halten bewirkt genau das,False,106739,2585
442,3473,"und es ist eine Gewohnheit, die so alt wie gebräuchlich ist,",False,109221,2585
443,2312,"obwohl es in den USA ein Gesetz gibt,",False,112694,2585
444,3534,"das Angestellten erlaubt, ihre Gehälter zu diskutieren.",False,115006,2585
445,2682,Ein bekanntes Beispiel  von vor Jahrzehnten.,True,119237,2585
446,2250,Die Geschäftsführung des Vanity-Fair-Magazins,False,121919,2585
447,2034,gab eine Mitteilung mit dem Betreff heraus.,False,124169,2585
448,3325,Verbot von Gesprächen unter  Angestellten über empfange Gehälter.,False,126203,2585
449,3296,Verbot von Gesprächen unter  Angestellten über empfangene Gehälter.,False,129528,2585
450,2147,Diese Mitteilung verärgerte jeden.,False,133392,2585
451,2246,"Die New Yorker Autoren Dorothy Parker,",False,135539,2585
452,1730,"Robert Benchley und Robert Sherwood,",False,137785,2585
453,2179,"alle Autoren des Algonquin Round Table,",False,139515,2585
454,3801,"entschieden, für Transparenz einzutreten und erschienen am nächsten Arbeitstag",False,141694,2585
455,3238,"mit einem Schild um den Hals, worauf ihre Gehälter standen.",False,145495,2585
457,2595,"Stellen Sie sich vor, bei  Ihrer Arbeit zu erscheinen,",True,150546,2585
458,3464,mit Ihrem Gehalt für jeden  sichtbar auf Ihre Brust geschrieben.,False,153141,2585
459,3640,Warum sollte ein Unternehmen überhaupt Lohndiskussionen verhindern wollen.,True,157273,2585
460,4106,"Warum ist es für manche Leute okay, während sich andere dagegen wehren.",False,160913,2585
461,3144,"Es stellt sich heraus, dass zusätzlich  zu den vermuteten Gründen,",False,165866,2585
462,3287,"Lohngeheimhaltung eine Möglichkeit  ist, viel Geld zu sparen.",False,169010,2585
463,1915,"Gehälter geheim zu halten,",False,172301,2585
464,2981,"führt zu dem, was Ökonomen  Informationsasymmetrie nennen.",False,174216,2585
465,2561,"Das ist eine Situation, in der in einer Verhandlung",False,177211,2585
466,3132,eine Partei sehr viel mehr Informationen hat als die andere.,False,179772,2585
467,3603,"Bei Einstellungen, Beförderungen, oder jährlichen Gehaltsgesprächen,",False,182904,2585
468,3592,"kann ein Arbeitgeber diese Geheimhaltung nutzen, um viel Geld zu sparen.",False,186507,2585
469,2908,"Stellen Sie sich vor, wie viel  besser Sie verhandeln könnten,",False,190358,2585
470,2447,wenn Sie die Gehälter  der anderen kennen würden.,False,193266,2585
471,1441,"Ökonomen warnen davor,",True,197322,2585
472,3201,dass Informationsasymmetrie Märkte ins Ungleichgewicht bringen kann.,False,198763,2585
473,2264,Jemand vergisst eine  Lohnabrechnung im Kopierer,False,201964,2585
474,1868,und plötzlich brüllen sich alle an.,False,204228,2585
475,1746,"Tatsächlich warnen sie davor,",False,206866,2585
476,5231,dass Informationsasymmetrie zu  totalem Martkversagen führen kann.,False,208612,2585
477,1988,"Ich glaube, wir sind kurz davor.",False,214095,2585
478,1256,Und zwar deshalb.,False,216083,2585
479,4912,Erstens. Die meisten Angestellten haben keine Ahnung vom Gehalt der Kollegen.,False,217339,2585
480,3844,In einer Umfrage aus dem Jahr  2015 mit über 70 000 Angestellten,False,222834,2585
481,3461,"gaben zwei Drittel von denen, die marktüblich bezahlt wurden, an,",False,226678,2585
482,2206,dass sie sich unterbezahlt fühlten.,False,230139,2585
483,2873,"Von denen, die sich unterbezahlt fühlten,",False,233036,2585
484,2977,"sagten 60 Prozent, dass sie vorhaben zu kündigen,",False,235909,2585
485,2968,"unabhängig davon wo sie lagen , unterbezahlt, überbezahlt",False,238886,2585
486,1953,oder genau im marktüblichen Bereich.,False,241854,2585
487,2630,"Wären Sie Teil dieser Umfrage,  was hätten Sie gesagt.",False,244070,2585
488,1310,Sind Sie unterbezahlt.,False,246700,2585
489,2343,"Warten Sie, wie sollen Sie das wissen,",False,248010,2585
490,2073,da Sie nicht darüber reden dürfen.,False,250353,2585
491,2469,Zweitens. Informationsasymmetrie.  ,True,252911,2585
492,3883,"Lohngeheimhaltung macht es leichter die Diskriminierung zu ignorieren,",False,255384,2585
493,2537,die es heute schon im Markt gibt.,False,259267,2585
494,3681,"In einem Bericht aus dem Jahr 2011 vom Institute for Women's Policy Research,",False,262217,2585
495,3854,lag das Lohngefälle zwischen Männern und Frauen bei 23  percent.,False,265898,2585
496,2619,Daher kommt der Ausdruck 77 Cents pro Dollar.,False,270451,2585
497,1267,"Aber im Staatsdienst,",False,273501,2585
498,2523,wo Gehälter in bestimmte Gruppierungen eingeteilt sind,False,274768,2585
499,3974,"und die Höhe jedem bekannt ist, schrumpft das Gefälle auf 11  percent,",False,277291,2585
500,2649,"und das, bevor man noch andere Faktoren überprüft,",False,281265,2585
501,3437,"über die sich Ökonomen streiten, ob man sie prüfen sollte oder nicht.",False,283914,2585
502,2509,"Wenn wir das Lohngefälle wirklich überbrücken wollen,",True,287351,2585
503,3198,sollten wir vielleicht anfangen unsere Gehaltslisten offenzulegen.,False,289860,2585
504,3078,"Wenn völliges Marktversagen so aussieht,",False,293058,2585
505,3692,"dann bleibt Offenheit der einzige Weg, um Fairness zu gewährleisten.",False,296136,2585
506,2161,"Ich verstehe, dass es unangenehm sein kann,",True,300174,2585
507,2234,"andere wissen zu lassen, wie viel man verdient.",False,302335,2585
508,1785,"Aber ist es nicht weniger unangenehm,",False,304569,2585
509,2594,"als sich ständig zu fragen,  ob man diskriminiert wird,",False,306354,2585
510,4375,oder ob Ihre Frau oder Tochter oder Schwester unfair bezahlt wird.,False,308948,2585
511,3944,"Offenheit bleibt der beste Weg, um Fairness zu sichern,",False,313323,2585
512,2383,und Lohntransparenz tut genau das.,False,317267,2585
513,2700,Deshalb haben Unternehmer und Führungskräfte,True,319991,2585
514,3013,schon seit Jahren mit  Gehaltsoffenlegungen experimentiert.,False,322695,2585
515,1247,So wie Dane Atkinson.,False,325708,2585
516,2187,"Dane ist ein mehrfacher Unternehmersgründer,",False,326955,2585
517,3382,der in vielen seiner Firmen Lohngeheimhaltung praktizierte,False,329142,2585
518,3271,"und diesen Umstand sogar nutze, um zwei gleich qualifizierte Leute",False,332524,2585
519,1776,"extrem unterschiedlich zu bezahlen,",False,335795,2585
520,2553,"abhängig davon, wie gut  sie verhandeln konnten.",False,337571,2585
521,3188,Dane erkannte den daraus  resultierenden Konflikt.,False,340124,2585
522,2331,"Als er sein neuestes Unternehmen SumAll startete,",False,343778,2585
523,3250,verpflichte er sich von Anfang  an zur Lohntransparenz.,False,346109,2585
524,1948,Die Ergebnisse waren erstaunlich.,False,349821,2585
525,1622,"Studie um Studie besagt,",False,352374,2585
526,1926,"wenn Leute wissen, wie sie bezahlt werden",False,353996,2585
527,2711,"und wie ihre Bezahlung im Vergleich zu ihren Kollegen ist,",False,355922,2585
528,2733,"arbeiten sie wahrscheinlich härter, um sich zu verbessern,",False,358633,2585
529,2463,sind engagierter und kündigen seltener.,False,361366,2585
530,1632,Deshalb ist Dane nicht allein.,True,363829,2585
531,2389,"Von Technologie-Start-ups wie Buffer,",False,365461,2585
532,3411,"bis zu den zehntausenden  Angestellten bei Whole Foods,",False,367850,2585
533,3107,"wo nicht nur das Gehalt  für jeden sichtbar ist,",False,371265,2585
534,3260,sondern auch die Leistungsdaten für jedes Geschäft und jede Abteilung,False,374372,2585
535,3317,"im Fimen-Intranet verfügbar ist, einsehbar für alle.",False,377632,2585
536,2522,Lohntransparenz gibt es in vielen Formen.,True,381935,2585
537,1658,Es gibt keine Patentlösung.,False,384461,2585
538,2464,"Manche machen ihre  Gehälter für alle sichtbar,",False,386119,2585
539,2231,manche nur innerhalb der Firma.,False,388583,2585
540,2949,Manche geben eine Formel zum  Kalkulieren der Gehälter heraus,False,390814,2585
541,1698,und andere nennen die Gehaltsebenen,False,393763,2585
542,1732,und ordnen jeden diesen Ebenen zu.,False,395461,2585
543,4573,"Sie müssen keine Schilder machen, die Ihre Angestellten im Büro tragen.",False,397193,2585
544,3064,"Sie müssen nicht der Einzige sein, der ein Schild trägt,",False,401768,2585
545,1646,das Sie zuhause angefertigt haben.,False,404832,2585
546,3180,Aber wir können alle mehr für Gehaltstransparenz tun.,False,406478,2585
547,1362,"Für diejenigen von Ihnen,",False,410113,2585
548,2708,die die Befugnis haben zu Transparenz voranzuschreiten.,False,411475,2585
549,1345,Es ist an der Zeit.,False,414183,2585
550,2662,"Für diejenigen, die diese  Befugnisse nicht besitzen.",False,415773,2585
551,2459,"Es ist Zeit, für Ihr Recht darauf einzutreten.",False,418435,2585
552,2175,"Also, wie viel verdienen Sie.",True,421263,2585
553,3097,"Und wie steht es im Vergleich zu dem, was Ihre Kollegen bekommen.",False,424016,2585
554,1643,Sie sollten es wissen.,False,427113,2585
555,1915,Und Ihre Kollegen auch.,False,429312,2585
556,1242,Danke schön.,True,431846,2585
558,2346,Eines Tages im Jahre 1819,True,419,1637
559,2759,5.500 km vor der Küste Chiles,False,2765,1637
560,2930,"in einer der entlegensten  Regionen des Pazifik,",False,5524,1637
561,4040,sahen 20 amerikanische Seeleute  ihr Schiff im Meer versinken.,False,8454,1637
562,2180,Ein Zusammenprall mit einem  Pottwal hatte ein katastrophales,False,12494,1637
563,2901,Loch in den Rumpf  des Schiffs gerissen.,False,14674,1637
564,2329,"Als ihr Schiff anfing, in  den Wellen zu versinken,",False,17575,1637
565,4313,drängten sich die Männer in  drei kleine Walboote.,False,19904,1637
566,2263,Sie waren 18.000 km von  zu Hause und fast,False,24217,1637
567,3223,2.000 km vom nächsten  Stück Land entfernt.,False,26480,1637
568,2204,In ihren kleinen Booten nahmen sie nur,False,29703,1637
569,1566,die wesentlichste  Navigationsausrüstung,False,31907,1637
570,3648,und beschränkte Nahrungs- und  Wasservorräte mit.,False,33473,1637
571,2204,"Es waren die Männer des  Walfängers Essex,",False,37121,1637
572,2655,deren Geschichte später Teile von  Moby Dick inspirieren sollte.,False,39325,1637
573,2949,"Sogar heute wäre ihre Situation  äußerst heikel,",True,41980,1637
574,1926,"aber denken Sie, wie viel schlimmer  es damals gewesen sein muss.",False,44929,1637
575,3225,"An Land wusste niemand, dass  etwas schief gegangen war.",False,46855,1637
576,2912,Kein Suchtrupp war für  diese Männer unterwegs.,False,50080,1637
577,2862,Die meisten von uns haben nie eine so,False,52992,1637
578,3503,"beängstigende Situation wie diese Seeleute erlebt,",False,55854,1637
579,1867,"aber wir alle wissen, wie es ist,  wenn man Angst hat.",False,59357,1637
580,2294,"Wir wissen, wie sich Angst anfühlt,",False,61224,1637
581,2104,"aber ich glaube nicht, dass wir  genug darüber nachdenken,",False,63518,1637
582,1645,was unserer Ängste bedeuten.,False,65622,1637
583,2837,"Wenn wir heranwachsen,  ermuntert man uns oft,",True,67267,1637
584,2913,"Angst als Schwäche zu sehen,  etwas Kindliches, das man ablegt,",False,70104,1637
585,2818,wie Milchzähne und Rollschuhe.,False,73017,1637
586,2495,"Ich glaube, dass dieses  Denken kein Zufall ist.",False,75835,1637
587,2607,"Neurologen haben gezeigt, dass Menschen",False,78330,1637
588,2739,"dazu veranlagt sind,  Optimisten zu sein.",False,80937,1637
589,2783,Vielleicht halten wir deshalb  Angst manchmal,False,83676,1637
590,1978,für eine Gefahr an sich.,False,86459,1637
591,2997,"Keine Sorge, sagen wir gern.  Keine Panik.",False,88437,1637
592,2649,"Im Deutschen ist Angst etwas,  das wir besiegen.",False,91434,1637
593,3833,"Sie ist etwas, das wir bekämpfen,  etwas, das wir überwinden.",False,94083,1637
594,2205,"Was, wenn wir Angst einmal  anders betrachten.",False,97916,1637
595,4143,"Was, wenn wir Angst als erstaunliche  Vorstellungsgabe betrachten,",False,100121,1637
596,2378,"etwas, das so tiefsinnig und  aufschlussreich sein kann",False,104264,1637
597,2654,wie Geschichtenerzählen selbst.,False,106642,1637
598,2593,Der Bezug zwischen Angst und Vorstellung  zeigt sich am einfachsten,True,109296,1637
599,3279,"bei Kindern, die oft äußerst  lebhafte Ängste haben.",False,111889,1637
600,2281,"Als Kind lebte ich in Kalifornien,",False,115168,1637
601,2689,"was in der Regel ein sehr netter Ort zum Leben ist,",False,117449,1637
602,4008,als Kind konnte Kalifornien für mich  aber auch ein bisschen gruselig sein.,False,120138,1637
603,3041,"Ich erinnere mich, wie bei  jedem kleinen Erdbeben",False,124146,1637
604,2433,der Kronleuchter über  unserem Esstisch,False,127187,1637
605,2175,beängstigend hin und her schwang.,False,129620,1637
606,2303,"Manchmal hatte ich nachts Angst,  dass das große",False,131795,1637
607,2521,"Erdbeben kommen würde,  während wir schliefen.",False,134098,1637
608,2872,"Über Kinder mit solchen  Ängsten sagen wir,",False,136619,1637
609,3228,dass sie eine lebhafte Vorstellung haben.,False,139491,1637
610,2390,"An einem gewissen Punkt jedoch  lernen die meisten,",False,142719,1637
611,2886,"solche Visionen aufzugeben,  und werden erwachsen.",False,145109,1637
612,2757,"Wir lernen, dass unterm Bett  keine Monster versteckt sind",False,147995,1637
613,2980,und nicht jedes Erdbeben  Häuser zum Einsturz bringt.,False,150752,1637
614,3408,"Vielleicht ist es kein Zufall, dass  einige unserer kreativsten Köpfe",False,153732,1637
615,3111,solche Ängste als Erwachsene  nicht aufgeben können.,False,157140,1637
616,3861,"Dieselben enormen Vorstellungskräfte, die  Über die Entstehung der Arten,",False,160251,1637
617,2857,"Jane Eyre und Auf der Suche nach  der verlorenen Zeit hervorbrachten,",False,164112,1637
618,3339,"schufen auch heftige Ängste,  die Charles Darwin, Charlotte Bronte",False,166969,1637
619,4456,und Marcel Proust noch  als Erwachsene verfolgten.,False,170308,1637
620,2929,"Die Frage ist also, was kann  der Rest von uns",False,174764,1637
621,3304,von kleinen Kindern und  Visionären über Angst lernen.,False,177693,1637
622,2860,"Kehren wir für einen Augenblick ins Jahr 1819 zurück,",True,180997,1637
623,3687,zur Situation der Besatzung  des Walfängers Essex.,False,183857,1637
624,2119,"Welche Ängste haben ihre Vorstellungskräfte hervorgerufen,",False,187544,1637
625,3756,als sie mitten im Pazifik trieben.,False,189663,1637
626,3549,Seit der Kenterung des Schiffes  waren 24 Stunden vergangen.,False,193419,1637
627,2703,"Es war für die Männer an der Zeit,  einen Plan zu machen,",False,196968,1637
628,2726,aber sie hatten sehr wenige Optionen.,False,199671,1637
629,2431,In seinem faszinierenden Bericht  über diese Katastrophe,False,202397,1637
630,2740,"schrieb Nathaniel Philbrick,  dass diese Männer so weit",False,204828,1637
631,4400,"von Land entfernt waren, wie man  auf der Erde nur sein kann.",False,207568,1637
