index,duration,content,startOfParagraph,startTime,ID
1782,3450,et une telle absence totale de peur,False,292661,1542
1783,4100,"qu'elle a pu marcher tout droit jusqu'à la première arme,",False,296111,1542
1784,4076,a mis la main dessus et l'a baissée.,False,300211,1542
1785,3518,Personne n'a été tué.,False,308564,1542
1786,3942,"Voilà ce que la maîtrise de la peur peut faire,",True,312097,1542
1787,2301,"non seulement face à des mitraillettes,",False,316039,1542
1788,4166,mais aussi dans un combat au couteau dans la rue.,False,318340,1542
1789,2365,Mais nous devons nous entraîner.,False,322506,1542
1790,1901,Qu'en est-il de notre peur .,False,324871,1542
1791,4954,J'ai un petit mantra.,False,326772,1542
1792,3441,Ma crainte s'engraisse,False,331726,1542
1793,2217,de l'énergie que je lui donne.,False,335167,1542
1794,2287,"Si elle grossit beaucoup,",False,337384,1542
1795,2362,ça arrivera probablement.,False,339671,1542
1796,4435,"Nous connaissons tous le syndrome de 3 heures du matin,",True,342033,1542
1797,2716,"quand quelque chose qui vous tracasse vous réveille,",False,346468,1542
1798,2390,"je vois que beaucoup le connaissent,",False,349184,1542
1799,3610,"et pendant une heure, vous tournez dans tous les sens,",False,351574,1542
1800,1678,"ça va de pire en pire,",False,355184,1542
1801,3122,"et à 4 heures du matin, vous êtes cloué sur l'oreiller",False,356862,1542
1802,2203,par un monstre gros comme ça.,False,359984,1542
1803,1934,La seule chose à faire,False,362187,1542
1804,1834,"est de se lever, de prendre une tasse de thé",False,364121,1542
1805,5316,et de s'asseoir avec la peur comme un enfant à côté de vous.,False,365955,1542
1806,2481,Vous êtes l'adulte.,False,371271,1542
1807,1887,La peur est l'enfant.,False,373752,1542
1808,1445,"Vous parlez à la peur,",False,375639,1542
1809,3186,"vous lui demandez ce qu'elle veut, ce qu'il lui faut.",False,377084,1542
1810,4617,Comment peut-on améliorer les choses .,False,380270,1542
1811,1750,Comment l'enfant peut-il se sentir plus fort .,False,384887,1542
1812,1449,Vous faites un plan.,False,386637,1542
1813,2005,"Vous dites .  Bon, maintenant nous allons nous rendormir.",False,388086,1542
1814,3767,"A 7 heures et demie, nous nous lèverons et voilà ce que nous ferons. .",False,390091,1542
1815,5732,"J'ai eu un de ces épisodes de 3 heures du matin dimanche,",True,393858,1542
1816,3985,paralysée par la peur de venir vous parler.,False,399606,1542
1818,1507,J'ai fait ce que j'ai dit.,False,405589,1542
1819,4129,"Je me suis levée, j'ai fait une tasse de thé, je me suis assise avec elle, j'ai tout fait",False,407096,1542
1820,4156,"et me voilà, encore partiellement paralysée, mais je suis là.",False,411225,1542
1822,2516,C'est ça la peur. Qu'en est-il de la colère .,True,419780,1542
1823,4402,"Là où il y a injustice, il y a la colère.",False,422296,1542
1824,2848,"Mais la colère est comme l'essence,",False,426698,1542
1825,3454,"si vous la vaporisez et que quelqu'un allume une allumette,",False,429546,1542
1826,2000,vous avez un enfer.,False,433000,1542
1827,5117,"Mais la colère comme moteur, dans un moteur, est puissante.",False,435000,1542
1828,4166,"Si nous pouvons mettre notre colère dans un moteur,",False,440117,1542
1829,1783,"elle peut nous faire avancer,",False,444283,1542
1830,2988,elle peut nous faire traverser des moments terribles,False,446066,1542
1831,3963,et elle peut nous donner une vraie puissance intérieure.,False,449054,1542
1832,3118,Je l'ai appris dans mon travail,True,453017,1542
1833,2264,avec les décideurs de l'arme nucléaire.,False,456135,1542
1834,2719,"Parce qu'au début, j'étais tellement outrée",False,458399,1542
1835,3316,des dangers auxquels ils nous exposaient,False,461118,1542
1836,5134,"que je voulais juste me disputer, les accuser et prouver qu'ils avaient tort.",False,464434,1542
1837,2533,Totalement inefficace.,False,469568,1542
1838,3749,Pour développer un dialogue pour le changement,False,472101,1542
1839,2073,nous devons faire face à notre colère.,False,475850,1542
1840,4677,"On peut être en colère contre la chose,",False,477923,1542
1841,2100,"les armes nucléaires dans le cas présent,",False,482600,1542
1842,3851,mais il est vain d'être en colère contre les gens.,False,484700,1542
1843,2615,Ce sont des êtres humains tout comme nous.,False,488551,1542
1844,2651,Ils font ce qu'ils pensent être le mieux.,False,491166,1542
1845,3983,C'est là-dessus que nous devons nous baser pour parler avec eux.,False,493817,1542
1846,2917,"Voilà la troisième, la colère.",True,497800,1542
1847,1400,Ca m'amène au point crucial,False,500717,1542
1848,3234,"de ce qui se passe, ou ce que je perçois comme en train de se passer,",False,502117,1542
1849,1065,"aujourd'hui, dans le monde .",False,505351,1542
1850,4018,le siècle dernier a été celui du pouvoir descendant.,False,506416,1542
1851,4265,C'étaient toujours les gouvernements qui disaient aux gens quoi faire.,False,510434,1542
1852,2035,"Ce siècle-ci, il y a un changement.",False,514699,1542
1853,3883,C'est une puissance ascendante ou populaire.,False,516734,1542
1854,3216,C'est comme des champignons qui poussent dans le béton.,False,520617,1542
1855,6681,"Ce sont des gens qui se joignent à des gens, comme Bundy vient de le dire, à des kilomètres de distance",False,523833,1542
1856,2273,pour apporter des changements.,False,530514,1542
1857,4266,Peace Direct a décelé très tôt,True,532787,1542
1858,3551,que les habitants des zones de conflit,False,537053,1542
1859,2436,savaient quoi faire.,False,540604,1542
1860,2216,Ils savent mieux que quiconque quoi faire.,False,543040,1542
1861,3282,Donc Peace Direct les soutient pour le faire.,False,545256,1542
1862,2199,Ils font des choses comme,False,548538,1542
1863,3168,"la démobilisation des milices,",False,550737,1542
1864,2603,"la reconstruction des économies,",False,553905,1542
1865,2350,"la réinstallation des réfugiés,",False,556508,1542
1866,5501,même la libération des enfants soldats.,False,558858,1542
1867,2866,Ils doivent risquer leur vie presque tous les jours,False,564359,1542
1868,3219,pour le faire.,False,567225,1542
1869,3814,"Ils se sont rendus compte,",False,570444,1542
1870,4933,que l'usage de la violence dans les situations dans lesquelles ils opèrent,False,574258,1542
1871,4519,"n'est pas seulement moins humain,",False,579191,1542
1872,2135,mais aussi moins efficace,False,583710,1542
1873,6531,"que l'utilisation de méthodes qui relient les gens entre eux, que la reconstruction.",False,585845,1542
1874,3932,Je pense que l'armée américaine,True,592376,1542
1875,6880,commence enfin à le comprendre.,False,596308,1542
1876,2709,Jusqu'à maintenant leur politique de lutte contre le terrorisme,False,603188,1542
1877,4833,"a été de tuer les insurgés presque à tout prix,",False,605897,1542
1878,3203,"et si des civils se trouvaient sur leur chemin,",False,610730,1542
1879,4266,on appelait ça  dommages collatéraux .,False,613933,1542
1880,6733,C'est tellement exaspérant et humiliant,False,618199,1542
1881,2350,"pour la population d'Afghanistan,",False,624932,1542
1882,4348,"que ça facilite le recrutement d'al-Qaida,",False,627282,1542
1883,3170,"lorsque les gens sont tellement dégoûtés, par exemple,",False,631630,1542
1884,2379,par les livres du Coran qu'on brûle.,False,634800,1542
1885,3001,La formation des troupes doit donc changer.,True,637179,1542
1886,5108,Je pense qu'il y a des signes qu'elle commence à changer.,False,640180,1542
1887,2784,Les militaires britanniques ont toujours été bien meilleurs dans ce domaine.,False,645288,1542
1888,5682,"Mais il y a un magnifique exemple qu'ils peuvent suivre,",False,648072,1542
1889,3168,celui d'un brillant lieutenant-colonel américain,False,653754,1542
1890,1665,qui s'appelle Chris Hughes.,False,656922,1542
1891,4217,"Il menait ses hommes dans les rues de Najaf,",False,658587,1542
1892,2168,"en Irak,",False,662804,1542
1893,5033,"et soudain des gens sont sortis des maisons des deux côtés de la route,",False,664972,1542
1894,4598,"en criant, en hurlant, très en colère,",False,670005,1542
1895,4468,"ils ont entouré ces très jeunes soldats qui étaient complètement terrifiés,",False,674603,1542
1896,2500,"qui ne savaient pas ce qui se passait, qui ne parlaient pas arabe.",False,679071,1542
1897,4250,Chris Hughes s'est avancé au milieu de la foule,False,681571,1542
1898,3869,"avec son arme au-dessus de sa tête, pointant vers le sol,",False,685821,1542
1899,1698,il a dit .  A genoux. ,False,689690,1542
1900,2800,Ces énormes soldats,False,691388,1542
1901,2633,"avec leurs sacs à dos et leurs armures,",False,694188,1542
1902,4474,se sont agenouillés en tremblant.,False,696821,1542
1903,6085,Un silence complet est tombé.,False,701295,1542
1904,2558,"Après environ deux minutes,",False,707380,1542
1905,4276,tout le monde s'est écarté et est rentré à la maison.,False,709938,1542
1906,5482,"Pour moi, c'est la sagesse en action.",True,714214,1542
1907,4166,"A ce moment-là, c'est ce qu'il a fait.",False,719696,1542
1908,5762,Ça se passe partout dans le monde aujourd'hui.,False,723862,1542
1909,1909,Vous ne me croyez pas .,False,729624,1542
1910,3659,Vous êtes-vous demandé,False,731533,1542
1911,4440,pourquoi et comment de si nombreuses dictatures se sont effondrées,False,735192,1542
1912,3351,au cours des 30 dernières années .,False,739632,1542
1913,5067,"Les dictatures en Tchécoslovaquie, en Allemagne de l'est",False,742983,1542
1914,4215,"en Estonie, en Lettonie, en Lituanie,",False,748050,1542
1915,2886,"au Mali, à Madagascar,",False,752265,1542
1916,3782,"en Pologne, aux Philippines,",False,755151,1542
1917,5083,"en Serbie, en Slovénie, je pourrais continuer,",False,758933,1542
1918,4590,et maintenant en Tunisie et en Égypte.,False,764016,1542
1919,4050,Ça n'est pas arrivé juste comme ça.,False,768606,1542
1920,3151,C'est largement dû à un livre,False,772656,1542
1921,4465,"écrit par un homme de 80 ans, à Boston, Gene Sharp.",False,775807,1542
1922,4017,Il a écrit un livre intitulé  De la dictature à la démocratie ,False,780272,1542
1923,5396,avec 81 méthodologies de résistance non violente.,False,784289,1542
1924,2087,Il est traduit en 26 langues.,False,789685,1542
1925,2084,Il s'est répandu partout dans le monde.,False,791772,1542
1926,7187,"Il est utilisé par les jeunes et les vieux partout dans le monde,",False,793856,1542
1927,5422,parce qu'il fonctionne et qu'il est efficace.,False,801043,1542
1928,4558,"C'est ce qui me donne de l'espoir,",True,806465,1542
1929,3753,"pas seulement de l'espoir, c'est ce qui me rend très positive en ce moment.",False,811023,1542
1930,4016,Parce que finalement les êtres humains comprennent.,False,814776,1542
1931,7618,"Nous adoptons des méthodes pratiques, faisables",False,818792,1542
1932,1584,pour répondre à ma question .,False,826410,1542
1933,6302,Comment faire face à une brute sans pour autant devenir un voyou .,False,827994,1542
1934,4410,Nous utilisons les compétences que j'ai décrites .,False,834296,1542
1935,3718,"la puissance intérieure, le développement de la puissance intérieure, grâce à la connaissance de soi,",False,838706,1542
1936,3566,"en reconnaissant et en travaillant avec notre peur,",False,842424,1542
1937,3518,"en utilisant la colère comme un carburant,",False,845990,1542
1938,2565,"en coopérant avec les autres,",False,849508,1542
1939,1935,"en se réunissant avec d'autres,",False,852073,1542
1940,2182,"grâce au courage,",False,854008,1542
1941,6969,"et plus important encore, à un engagement à la non-violence active.",False,856190,1542
1942,4114,Je ne crois pas seulement dans la non-violence.,True,863159,1542
1943,2935,Je n'ai pas à y croire.,False,867273,1542
1944,3550,Je vois partout dans le monde la preuve de son efficacité.,False,870208,1542
1945,6050,"Je vois que nous, les gens ordinaires,",False,873758,1542
1946,6318,"pouvons faire ce qu'ont fait Aung San Suu Kyi, Ghandi et Mandela.",False,879808,1542
1947,2723,Nous pouvons mettre fin,False,886126,1542
1948,4999,au siècle le plus sanglant que l'humanité ait jamais connu.,False,888849,1542
1949,7941,Nous pouvons nous organiser pour vaincre l'oppression,False,893848,1542
1950,2618,en ouvrant nos cœurs,False,901789,1542
1951,5850,et en renforçant cette incroyable résolution.,False,904407,1542
1952,4600,Cette sincérité est exactement ce que j'ai vécu,True,910257,1542
1953,4434,dans toute l'organisation de ce rassemblement depuis que je suis arrivée hier.,False,914857,1542
1954,2121,Merci.,False,919291,1542
1956,3000,"Nous sommes donc en 1995,",True,0,1126
1957,2000,Je suis à la fac,False,3000,1126
1958,3000,et avec une amie nous partons pour un périple routier,False,5000,1126
1959,2000,"depuis Providence, Rhode Island",False,8000,1126
1960,2000,"jusqu'à Portland, Oregon.",False,10000,1126
1961,3000,"Et vous voyez, nous sommes jeunes et des chômeurs,",False,12000,1126
1962,2000,donc nous ne prenons que des routes secondaires,False,15000,1126
1963,2000,qui traversent les parcs d'État,False,17000,1126
1964,3000,et des forêts nationales -,False,19000,1126
1965,3000,en gros l'itinéraire le plus long possible.,False,22000,1126
1966,3000,"Et quelque part au milieu du Dakota du Sud,",False,26000,1126
1967,3000,je me tourne vers mon amie,False,29000,1126
1968,2000,et je lui pose une question,False,32000,1126
1969,2000,qui me préoccupe,False,34000,1126
1970,3000,depuis 3000 kilomètres.,False,36000,1126
1971,4000,C'est quoi ce chinois que je n'arrête pas de voir sur le bord de la route.,False,40000,1126
1972,4000,Mon ami me regarde sans rien comprendre.,False,47000,1126
1973,2000,Il y a en fait un homme au premier rang,False,51000,1126
1974,3000,qui fait une imitation parfaite de son regard.,False,53000,1126
1976,2000,"Et je dis . Tu sais,",False,59000,1126
1977,2000,tous les panneaux qu'on voit tout le temps,False,61000,1126
1978,3000,avec le chinois dessus. ,False,63000,1126
1979,3000,"Elle me regarde quelques instants,",False,67000,1126
1980,3000,"puis elle craque,",False,70000,1126
1981,2000,parce qu'elle comprend de quoi je parle.,False,73000,1126
1982,3000,Et ce dont je parle c'est ça,False,75000,1126
1984,4000,"A droite, le célèbre chinois qui signale la zone de pique-nique.",False,84000,1126
1986,4000,J'ai passé les cinq dernières années de ma vie,True,90000,1126
1987,2000,à réfléchir à des situations,False,94000,1126
1988,3000,exactement comme celle-là -,False,96000,1126
1989,2000,pourquoi nous ne comprenons parfois pas,False,99000,1126
1990,2000,"les panneaux qui nous entourent,",False,101000,1126
1991,3000,"et comment nous nous comportons quand cela se produit,",False,103000,1126
1992,4000,et ce que tout cela peut nous dire sur la nature humaine.,False,106000,1126
1993,2000,"En d'autres termes, comme l'a dit Chris,",False,110000,1126
1994,2000,j'ai passé les cinq dernières années,False,112000,1126
1995,3000,à réfléchir aux erreurs que nous faisons.,False,114000,1126
1996,3000,"Cela peut vous sembler un choix de carrière étrange,",False,117000,1126
1997,3000,mais ça a fait un grand avantage.,False,120000,1126
1998,2000,pas de concurrence.,False,123000,1126
2000,3000,"En fait, la plupart d'entre nous faisons tout notre possible",False,127000,1126
2001,3000,"pour éviter de réfléchir au fait de se tromper,",False,130000,1126
2002,2000,ou du moins pour éviter de réfléchir la possibilité,False,133000,1126
2003,2000,que nous avons tort.,False,135000,1126
2004,2000,Nous restons dans l'abstrait.,False,137000,1126
2005,2000,Nous savons tous que tout le monde dans cette salle fait des erreurs.,False,139000,1126
2006,3000,"L'espèce humaine, en général, est faillible - bon.",False,142000,1126
2007,3000,"Mais quand il s'agit de moi là tout de suite,",True,146000,1126
2008,2000,"de tout ce en quoi je crois,",False,149000,1126
2009,3000,"ici dans le temps présent,",False,151000,1126
2010,4000,tout d'un coup toute cette appréciation abstraite de la faillibilité,False,154000,1126
2011,3000,s'envole -,False,158000,1126
2012,3000,et je ne peux pas vraiment penser à quelque chose sur quoi je me trompe.,False,161000,1126
2013,3000,"Et le fait est, nous vivons dans le temps présent.",False,165000,1126
2014,3000,"Nous allons à des réunions dans le temps présent,",False,168000,1126
2015,2000,"nous allons en vacances en famille dans le temps présent,",False,171000,1126
2016,4000,nous nous rendons aux urnes et nous votons dans le présent.,False,173000,1126
2017,3000,"Donc, effectivement, nous en venons tous à traverser tout la vie,",False,177000,1126
2018,2000,pris au piège dans cette petite bulle,False,180000,1126
2019,3000,où on a l'impression d'avoir toujours raison pour tout.,False,182000,1126
2020,2000,Je pense que c'est un problème.,True,186000,1126
2021,3000,"Je pense que c'est un problème pour chacun de nous en tant qu'individus,",False,188000,1126
2022,3000,"dans notre vie personnelle et professionnelle,",False,191000,1126
2023,3000,"et je pense que c'est un problème pour nous tous, collectivement en tant que culture.",False,194000,1126
2024,2000,Donc ce que je veux faire aujourd'hui,False,197000,1126
2025,3000,"est, tout d'abord, parler de pourquoi nous sommes coincés",False,199000,1126
2026,2000,au cœur de cette impression d'avoir raison.,False,202000,1126
2027,3000,"Et deuxièmement, pourquoi c'est un tel problème.",False,204000,1126
2028,2000,"Et enfin, je tiens à vous convaincre",False,207000,1126
2029,2000,qu'il est possible,False,209000,1126
2030,2000,"de sortir de cette impression,",False,211000,1126
2031,2000,"et que, si vous pouvez le faire,",False,213000,1126
2032,2000,c'est le plus grand bond,False,215000,1126
2033,3000,"moral, intellectuel et créatif que vous puissiez faire.",False,217000,1126
2034,2000,Alors pourquoi nous retrouvons-nous coincés,True,222000,1126
2035,2000,dans cette impression d'avoir raison.,False,224000,1126
2036,3000,Une des raisons a en fait à voir avec une impression d'avoir tort.,False,226000,1126
2037,2000,Alors laissez-moi vous demander quelque chose -,False,229000,1126
2038,4000,"ou plutôt, laissez-moi vous demander quelque chose, parce que vous êtes ici.",False,231000,1126
2039,3000,"Quelle impression ça fait , du point de vue émotionnel ,",False,235000,1126
2040,3000,quelle impression ça fait d'avoir tort.,False,238000,1126
2041,3000,Horrible. Mortel.,False,241000,1126
2042,2000,"Embarrassant. Très bien, magnifique, très bien.",False,244000,1126
2043,2000,"Horrible, mortel, embarrassant -",False,246000,1126
2044,3000,"merci, ce sont d'excellentes réponses,",False,248000,1126
2045,3000,mais ce sont des réponses à une question différente.,False,251000,1126
2046,2000,Vous répondez en fait à la question.,False,254000,1126
2047,3000,qu'est-ce que ça fait de se rendre compte que vous avez tort.,False,256000,1126
2049,3000,"Vous rendre compte que vous avez tort, c'est un peu comme tout cela et beaucoup d'autres choses, non.",False,263000,1126
2050,3000,"Je veux dire que ça peut être dévastateur, ça peut être révélateur,",False,266000,1126
2051,2000,"ça peut être assez drôle,",False,269000,1126
2052,3000,comme mon erreur stupide de chinois.,False,271000,1126
2053,3000,Mais se tromper,False,274000,1126
2054,2000,ne ressemble à rien.,False,277000,1126
2055,3000,Je vais vous donner une analogie.,True,279000,1126
2056,2000,Vous souvenez-vous de ce dessin animé Loony Tunes,False,282000,1126
2057,2000,où il y a ce coyote pathétique,False,284000,1126
2058,2000,qui poursuit toujours et de n'attrape jamais Bip Bip.,False,286000,1126
2059,3000,"Dans presque tous les épisodes de ce dessin animé,",False,288000,1126
2060,2000,il y a un moment où le coyote poursuit Bip bip,False,291000,1126
2061,2000,"et Bip Bip court au-delà d'une falaise,",False,293000,1126
2062,3000,"c'est sans problème, c'est un oiseau, il peut voler.",False,295000,1126
2063,4000,"Mais le fait est, le coyote court au-delà de la falaise après lui.",False,298000,1126
2064,2000,Et ce qui est drôle -,False,302000,1126
2065,2000,du moins si vous avez six ans -,False,304000,1126
2066,2000,est que pour le coyote c'est sans problème non plus.,False,306000,1126
2067,2000,"Il continue de courir ,",False,308000,1126
2068,2000,jusqu'au moment où il regarde vers le bas,False,310000,1126
2069,3000,et se rend compte qu'il est dans les airs.,False,312000,1126
2070,3000,C'est alors qu'il tombe.,False,315000,1126
2071,2000,Lorsque nous avons tort à propos de quelque chose -,False,319000,1126
2072,3000,"pas quand nous nous en rendons compte, mais avant cela -",False,321000,1126
2073,3000,nous sommes comme ce coyote,False,324000,1126
2074,3000,"après qu'il soit au-delà de la falaise et, avant qu'il baisse les yeux.",False,327000,1126
2075,3000,"Vous savez, nous avons déjà tort,",False,331000,1126
2076,2000,"nous sommes déjà en difficulté,",False,334000,1126
2077,3000,mais nous avons l'impression d'être sur la terre ferme.,False,336000,1126
2078,3000,Donc je devrais en fait corriger une chose que j'ai dite il y a un instant.,False,340000,1126
2079,3000,"Quand on se trompe, on ressent bien quelque chose ,",False,343000,1126
2080,3000,on a l'impression qu'on a raison.,False,346000,1126
2082,3000,"Donc, c'est une des raisons, une raison structurelle,",True,352000,1126
2083,2000,pour laquelle nous sommes coincés dans ce sentiment de justesse.,False,355000,1126
2084,2000,C'est ce que j'appelle la cécité d'erreur.,False,357000,1126
2085,2000,"La plupart du temps,",False,359000,1126
2086,3000,nous n'avons aucune sorte de repère interne,False,361000,1126
2087,2000,"pour nous faire savoir que nous avons tort à propos de quelque chose,",False,364000,1126
2088,3000,jusqu'à ce qu'il soit trop tard.,False,366000,1126
2089,3000,Mais il y a aussi une 2ème raison pour laquelle nous sommes coincés dans cette impression -,False,369000,1126
2090,2000,et elle est d'ordre culturel.,False,372000,1126
2091,3000,Pensez un instant à l'école élémentaire.,False,375000,1126
2092,2000,"Vous êtes assis là en classe,",False,378000,1126
2093,3000,"et votre professeur vous rend des questionnaires,",False,380000,1126
2094,2000,et l'un d'eux ressemble à ceci.,False,383000,1126
2095,2000,"Ce n'est pas le mien, au fait.",False,385000,1126
2097,3000,"Donc là vous êtes à l'école primaire,",False,389000,1126
2098,2000,et vous savez exactement quoi penser,False,392000,1126
2099,3000,de l'enfant qui a reçu ce document.,False,394000,1126
2100,3000,"C'est le cancre, le perturbateur,",False,397000,1126
2101,3000,celui qui ne fait jamais ses devoirs.,False,400000,1126
2102,3000,"Donc, quand vous avez 9 ans,",False,403000,1126
2103,2000,"vous avez déjà appris, tout d'abord,",False,406000,1126
2104,2000,que les gens qui se trompent souvent,False,408000,1126
2105,3000,"sont paresseux, des idiots irresponsables -",False,410000,1126
2106,2000,"et en second lieu,",False,413000,1126
2107,2000,que le moyen de réussir dans la vie,False,415000,1126
2108,3000,est de ne jamais faire d'erreurs.,False,417000,1126
2109,4000,Nous apprenons ces très mauvaises leçons vraiment bien.,True,421000,1126
2110,2000,Et beaucoup d'entre nous -,False,426000,1126
2111,4000,"et je soupçonne, en particulier beaucoup d'entre nous dans cette salle -",False,428000,1126
2112,2000,les assument en devenant,False,432000,1126
2113,2000,"de parfaites petites têtes de classe,",False,434000,1126
2114,3000,"des perfectionnistes, qui veulent toujours faire plus.",False,436000,1126
2115,2000,"Bon,",False,439000,1126
2116,4000,"M. le Directeur financier, astrophysicien, ultra-marathonien.",False,441000,1126
2118,4000,"Il se trouve que vous êtes tous directeurs financiers, astrophysiciens, ultra-marathoniens.",False,452000,1126
2119,2000,"D'accord, bon.",False,456000,1126
2120,3000,Sauf que nous flippons,False,458000,1126
2121,2000,à la possibilité que nous nous soyons trompés.,False,461000,1126
2122,3000,"Parce que, d'après ceci,",False,463000,1126
2123,2000,se tromper sur quelque chose,False,466000,1126
2124,3000,signifie qu'il y a quelque chose qui ne va pas en vous.,False,468000,1126
2125,2000,"Alors nous insistons que nous avons raison,",False,471000,1126
2126,2000,parce que ça nous fait nous sentir intelligents et responsables,False,473000,1126
2127,3000,et vertueux et en sécurité.,False,475000,1126
2128,2000,Permettez-moi de vous raconter une histoire.,True,479000,1126
2129,2000,"Il y a deux ans,",False,481000,1126
2130,3000,une femme entre au centre médical Beth Israel Deaconess pour être opérée.,False,483000,1126
2131,2000,Beth Israel est à Boston.,False,486000,1126
2132,2000,C'est l'hôpital universitaire de Harvard -,False,488000,1126
2133,2000,l'un des meilleurs hôpitaux dans le pays.,False,490000,1126
2134,3000,"Donc, cette femme arrive et elle est emmenée dans la salle d'opération.",False,492000,1126
2135,2000,"Elle est anesthésiée, le chirurgien opère -",False,495000,1126
2136,3000,"la recoud, l'envoie en salle de réveil.",False,497000,1126
2137,3000,Tout semble s'être bien passé.,False,500000,1126
2138,3000,"Et elle se réveille, et elle regarde le bas de son corps,",False,503000,1126
2139,4000,et elle dit. Pourquoi est-ce le mauvais côté de mon corps dans des bandages.,False,506000,1126
2140,3000,"Eh bien, le mauvais côté de son corps est dans des bandages",False,510000,1126
2141,2000,parce que le chirurgien a réalisé une opération majeure,False,513000,1126
2142,3000,sur sa jambe gauche au lieu de sa droite.,False,515000,1126
2143,3000,Lorsque le vice-président pour la qualité des soins de santé au Beth Israel,False,519000,1126
2144,3000,"a parlé de cet incident,",False,522000,1126
2145,3000,il a dit quelque chose de très intéressant.,False,525000,1126
2146,3000,"Il a dit, Pour une raison quelconque,",False,528000,1126
