level_0,index,duration,content,startOfParagraph,startTime,ID
1871,1893,4276,همه جمعیت پراکنده شدند و به خانه هایشان برگشتند.,False,709938,1542
1872,1894,5482,و این به نظر من تیزهوشی در واکنش است.,True,714214,1542
1873,1895,4166,در آن لحظه او این تصمیم را گرفت.,False,719696,1542
1874,1896,5762,و این اتفاق همه جا الان در حال رخ دادن است.,False,723862,1542
1875,1897,1909,حرف مرا باور نمی کنید.,False,729624,1542
1876,1898,3659,تا حالا از خودتان پرسیده اید,False,731533,1542
1877,1899,4440,چرا و چگونه این همه دیکتاتور در طی ۳۰ سال گذشته,False,735192,1542
1878,1900,3351,سرنگون شده اند.,False,739632,1542
1879,1901,5067,دیکتاتوری های چک، آلمان شرقی,False,742983,1542
1880,1902,4215,استونی، لاتویا، لیتوانی,False,748050,1542
1881,1903,2886,مالی، ماداگاسکار,False,752265,1542
1882,1904,3782,لهستان و فیلیپین,False,755151,1542
1883,1905,5083,صربستان و اسلوانی و این لیست ادامه دارد,False,758933,1542
1884,1906,4590,تا میرسیم به تونس و مصر.,False,764016,1542
1885,1907,4050,و این اتفاقی نیست که اخیرا رخ داده باشد.,False,768606,1542
1886,1908,3151,خیلی از این سرنگونی ها به خاطر کتاب نوشته شده,False,772656,1542
1887,1909,4465,توسط یک پیرمرد ۸۰ ساله به نام جین شارپ در بوستون است.,False,775807,1542
1888,1910,4017,او یک کتاب به نام  از دیکتاتوری به دموکراسی نوشته است,False,780272,1542
1889,1911,5396,که در آن ۸۱ راه مقاومت بدون استفاده از خشونت را توضیح داده است.,False,784289,1542
1890,1912,2087,و این کتاب به ۲۶ زبان ترجمه شده است و,False,789685,1542
1891,1913,2084,در تمام دنیا محبوبیت زیادی پیدا کرده است,False,791772,1542
1892,1914,7187,و پیر و جوان در هر جای دنیا آن را می خوانند,False,793856,1542
1893,1915,5422,زیرا این کتاب موثر و کاربردی است.,False,801043,1542
1894,1916,4558,و این همان چیزی است که به من امید می دهد,True,806465,1542
1895,1917,3753,نه تنها امید، بلکه این همان چیزی است که من دید خیلی مثبتی می دهد.,False,811023,1542
1896,1918,4016,زیرا بالاخره بشر اصل موضوع را فهمیده است.,False,814776,1542
1897,1919,7618,ما روشهای عملی و متدهای انجام شدنی را داریم درک می کنیم,False,818792,1542
1898,1920,1584,و در جواب سوالم,False,826410,1542
1899,1921,6302,که من چگونه با یک زورگو باید مقابله کنم، بدون آنکه خودم تبدیل به یک گردن کلفت بی شرف شوم.,False,827994,1542
1900,1922,4410,می گویم. ما باید از راههایی که گفتم استفاده کنیم .,False,834296,1542
1901,1923,3718,قدرت درونی و توسعه این نیروی درونی از طریق خودآگاهی،,False,838706,1542
1902,1924,3566,تشخیص و کنارآمدن با ترس هایمان،,False,842424,1542
1903,1925,3518,استفاده از خشم به عنوان یک سوخت,False,845990,1542
1904,1926,2565,همکاری با دیگران،,False,849508,1542
1905,1927,1935,همراه و یکصدا شدن با دیگران،,False,852073,1542
1906,1928,2182,شجاعت و,False,854008,1542
1907,1929,6969,از همه مهم تر پایداری به اصل عدم استفاده از خشونت.,False,856190,1542
1908,1930,4114,و حالا این فقط من نیستم که به عدم خشونت اعتقاد دارم.,True,863159,1542
1909,1931,2935,نیازی نیست به آن اعتقاد داشته باشم تا محقق شود.,False,867273,1542
1910,1932,3550,دلالیل زیادی در جاهای مختلف می بینم که چطور اثر مثبت به جای می گذارد.,False,870208,1542
1911,1933,6050,و می بینم که ما، مردم معمولی،,False,873758,1542
1912,1934,6318,می توانیم همان کاری که آنگ سان سو چی و گاندی و ماندلا انجام دادند را هم انجام بدهیم.,False,879808,1542
1913,1935,2723,می توانیم پایان بدهیم,False,886126,1542
1914,1936,4999,به خونین ترین قرنی که بشریت تا به حال به خود دیده است.,False,888849,1542
1915,1937,7941,و می توانیم برای غلبه بر ظلم با باز کردن,False,893848,1542
1916,1938,2618,قلبهایمان سازمان دهی شویم و,False,901789,1542
1917,1939,5850,و همچنین این تصمیم شگفت انگیز را تقویت کنیم,False,904407,1542
1918,1940,4600,و این قلب یا آغوش باز، دقیقا همان چیزی است که در تمام این همایش,True,910257,1542
1919,1941,4434,از دیروز که اینجا رسیده ام، تجربه کرده ام.,False,914857,1542
1920,1942,2121,متشکرم.,False,919291,1542
1921,1944,3000,خب، فرض کنید الان سال ۱۹۹۵ هست، منم در کالج هستم,True,0,1126
1922,1945,2000,خب، فرض کنید الان سال ۱۹۹۵ هست، منم در کالج هستم,False,3000,1126
1923,1946,3000,"من و دوستم رفتیم سفر. از Providence, Rhode Island به Portland, Oregon.",False,5000,1126
1924,1947,2000,"من و دوستم رفتیم سفر. از Providence, Rhode Island به Portland, Oregon.",False,8000,1126
1925,1948,2000,"من و دوستم رفتیم سفر. از Providence, Rhode Island به Portland, Oregon.",False,10000,1126
1926,1949,3000,از اونجایی که ما جوون و بیکار بودیم، تمام مسیر رو از جاده‌های پشتی‌، از طریق پارک‌های ایالتی و,False,12000,1126
1927,1950,2000,از اونجایی که ما جوون و بیکار بودیم، تمام مسیر رو از جاده‌های پشتی‌، از طریق پارک‌های ایالتی و,False,15000,1126
1928,1951,2000,از اونجایی که ما جوون و بیکار بودیم، تمام مسیر رو از جاده‌های پشتی‌، از طریق پارک‌های ایالتی و,False,17000,1126
1929,1952,3000,"جنگل‌های ملی‌ رفتیم , اساسا طولانی تر از این دیگه نمی‌شد.",False,19000,1126
1930,1953,3000,"جنگل‌های ملی‌ رفتیم , اساسا طولانی تر از این دیگه نمی‌شد.",False,22000,1126
1931,1954,3000,و یجا وسط دکاتا جنوبی من ازدوستم سوالی که بیش از ۳۰۰۰km ذهن منو به خود مشغول کرده بود پرسیدم.,False,26000,1126
1932,1955,3000,و جایی وسط دکاتا جنوبی من ازدوستم سوالی که بیش از ۳۰۰۰km ذهن منو به خود مشغول کرده بود پرسیدم.,False,29000,1126
1933,1956,2000,و جایی وسط دکاتا جنوبی من ازدوستم سوالی که بیش از ۳۰۰۰km ذهن منو به خود مشغول کرده بود پرسیدم.,False,32000,1126
1934,1957,2000,و جایی وسط دکاتا جنوبی من ازدوستم سوالی که بیش از ۳۰۰۰km ذهن منو به خود مشغول کرده بود پرسیدم.,False,34000,1126
1935,1958,3000,و جایی وسط دکاتا جنوبی من ازدوستم سوالی که بیش از ۳۰۰۰km ذهن منو به خود مشغول کرده بود پرسیدم.,False,36000,1126
1936,1959,4000,این علامت که به زبون چینی‌ نوشته شده معنیش چیه کنار جاده‌.,False,40000,1126
1937,1960,4000,دوستم با تعجب به من زول میزنه.,False,47000,1126
1938,1961,2000,یه آقای محترم اینجا نشسته که دقیقا شبیه دوست من توی اون لحظه شده.,False,51000,1126
1939,1962,3000,یه آقای محترم اینجا نشسته که دقیقا شبیه دوست من توی اون لحظه شده.,False,53000,1126
1940,1964,2000,منم میگفتم این علامتها رو که چینی‌ نوشته منظورمه.,False,59000,1126
1941,1965,2000,منم میگفتم این علامتها رو که چینی‌ نوشته منظورمه.,False,61000,1126
1942,1966,3000,منم میگفتم این علامتها رو که چینی‌ نوشته منظورمه.,False,63000,1126
1943,1967,3000,دوستم دوباره برای چند لحظه به من خیره میشه، بعد یهو از جامی‌پره، چون تازه متوجه میشه من کدوم علامتها رو میگفتم.,False,67000,1126
1944,1968,3000,دوستم دوباره برای چند لحظه به من خیره میشه، بعد یهو از جامی‌پره، چون تازه متوجه میشه من کدوم علامتها رو میگفتم.,False,70000,1126
1945,1969,2000,دوستم دوباره برای چند لحظه به من خیره میشه، بعد یهو از جامی‌پره، چون تازه متوجه میشه من کدوم علامتها رو میگفتم.,False,73000,1126
1946,1970,3000,دوستم دوباره برای چند لحظه به من خیره میشه، بعد یهو از جامی‌پره، چون تازه متوجه میشه من کدوم علامتها رو میگفتم.,False,75000,1126
1947,1972,4000,آره درست فهمیدین، همون علامتهای چینی‌ معروف واسه منطقه مخصوص کمپینگ.,False,84000,1126
1948,1974,4000,"من ۵ سال گذشته رو فقط به این شرایطی شبیه این فکر می‌کردم,",True,90000,1126
1949,1975,2000,"من ۵ سال گذشته رو فقط به این شرایطی شبیه این فکر می‌کردم,",False,94000,1126
1950,1976,3000,"من ۵ سال گذشته رو فقط به این شرایطی شبیه این فکر می‌کردم,",False,96000,1126
1951,1977,2000,به اینکه چرا ما گاهی‌ علامتهای اطراف خودمون رو اشتباه میفهمیم،,False,99000,1126
1952,1978,2000,به اینکه چرا ما گاهی‌ علامتهای اطراف خودمون رو اشتباه میفهمیم،,False,101000,1126
1953,1979,3000,رفتار ما وقتی‌ این اتفاق میفته چگونه است، و از این چه نتیجه‌ای درباره رفتار آدمی‌ می‌شه گرفت.,False,103000,1126
1954,1980,4000,رفتار ما وقتی‌ این اتفاق میفته چگونه است، و از این چه نتیجه‌ای درباره رفتار آدمی‌ می‌شه گرفت.,False,106000,1126
1955,1981,2000,به عبارت دیگه همینطور که کریس گفت من ۵ ساله که دارم درباره اشتباه کردن فکر می‌کنم.,False,110000,1126
1956,1982,2000,به عبارت دیگه همینطور که کریس گفت من ۵ ساله که دارم درباره اشتباه کردن فکر می‌کنم.,False,112000,1126
1957,1983,3000,به عبارت دیگه همینطور که کریس گفت من ۵ ساله که دارم درباره اشتباه کردن فکر می‌کنم.,False,114000,1126
1958,1984,3000,شما ممکنه به این به عنوان یه شغل عجیب اعتراض داشته باشید،,False,117000,1126
1959,1985,3000,ولی‌ در واقع این یه حسن بزرگ داره. رقابت کاری در این شغل نیست.,False,120000,1126
1960,1986,2000,ولی‌ در واقع این یه حسن بزرگ داره. رقابت کاری در این شغل نیست.,False,123000,1126
1961,1988,3000,به عبارت دیگر بیشتر ما‌ها همه سعی‌مون رو میکنیم که نخوایم زمانی‌ فکر کنیم که اشتباه کردیم.,False,127000,1126
1962,1989,3000,به عبارت دیگر بیشتر ما‌ها همه سعی‌مون رو میکنیم که نخوایم زمانی‌ فکر کنیم که اشتباه کردیم.,False,130000,1126
1963,1990,2000,یا دست کم نخوایم فکر کنیم که ما شخصاً اشتباهی‌ رو مرتکب شدیم.,False,133000,1126
1964,1991,2000,یا دست کم نخوایم فکر کنیم که ما شخصاً اشتباهی‌ رو مرتکب شدیم.,False,135000,1126
1965,1992,2000,ما اینو بصورت انتزاعی میبینیم.,False,137000,1126
1966,1993,2000,میدونیم که همه ما در این سالن گاهی مرتکب اشتباه میشیم. گونه بشر در کل خطا پذیره، بسیار خب.,False,139000,1126
1967,1994,3000,میدونیم که همه ما در این سالن گاهی مرتکب اشتباه میشیم. گونه بشر در کل خطا پذیره، بسیار خب.,False,142000,1126
1968,1995,3000,ولی‌ وقتی‌ نوبت به من میرسه، با همه باورهایی که در اینباره، در حال حاضر دارم،,True,146000,1126
1969,1996,2000,ولی‌ وقتی‌ نوبت به من میرسه، با همه باورهایی که در اینباره، در حال حاضر دارم،,False,149000,1126
1970,1997,3000,ولی‌ وقتی‌ نوبت به من میرسه، با همه باورهایی که در اینباره، در حال حاضر دارم،,False,151000,1126
1971,1998,4000,"ناگهان همه باور به جایز الخطا بودن انسان از یادم میره , و من دیگه نمی‌تونم درباره چیزایی‌ که من در باره شون اشتباه میکردم فکر کنم.",False,154000,1126
1972,1999,3000,"ناگهان همه باور به جایز الخطا بودن انسان از یادم میره , و من دیگه نمی‌تونم درباره چیزایی‌ که من در باره شون اشتباه میکردم فکر کنم.",False,158000,1126
1973,2000,3000,"ناگهان همه باور به جایز الخطا بودن انسان از یادم میره , و من دیگه نمی‌تونم درباره چیزایی‌ که من در باره شون اشتباه میکردم فکر کنم.",False,161000,1126
1974,2001,3000,و نکته اینجاست که حال حاضر جاییه که ما الان در اون داریم زندگی‌ می‌کنیم.,False,165000,1126
1975,2002,3000,ما در زمان حال میریم به جلسه کاری، در زمان حال میریم به تعطیلات خانوادگی.یا میریم واسه رای دادن.,False,168000,1126
1976,2003,2000,ما در زمان حال میریم به جلسه کاری، در زمان حال میریم به تعطیلات خانوادگی.یا میریم واسه رای دادن.,False,171000,1126
1977,2004,4000,ما در زمان حال میریم به جلسه کاری، در زمان حال میریم به تعطیلات خانوادگی.یا میریم واسه رای دادن.,False,173000,1126
1978,2005,3000,پس، اساساً ما در سفر زندگی‌ با حبابی که بدور خود کشیده ایم مشغول سفر هستیم، حبابی بنام حق به جانب بودن.,False,177000,1126
1979,2006,2000,پس، اساساً ما در سفر زندگی‌ با حبابی که بدور خود کشیده ایم مشغول سفر هستیم، حبابی بنام حق به جانب بودن.,False,180000,1126
1980,2007,3000,پس، اساساً ما در سفر زندگی‌ با حبابی که بدور خود کشیده ایم مشغول سفر هستیم، حبابی بنام حق به جانب بودن.,False,182000,1126
1981,2008,2000,من فکر میکنم این یه مشکله. هم برای ما به صورت فردی و هم به صورت اجتماعی.,True,186000,1126
1982,2009,3000,من فکر میکنم این یه مشکله. هم برای ما به صورت فردی و هم به صورت اجتماعی.,False,188000,1126
1983,2010,3000,من فکر میکنم این یه مشکله. هم برای ما به صورت فردی و هم به صورت اجتماعی.,False,191000,1126
1984,2011,3000,من فکر میکنم این یه مشکله. هم برای ما به صورت فردی و هم به صورت اجتماعی.,False,194000,1126
1985,2012,2000,پس کاری که من امروز می‌خوام انجام بدم اینه که درباره اینکه چرا ما در این حباب حق به جانب بودن گیر میفتیم، صحبت کنم.,False,197000,1126
1986,2013,3000,پس کاری که من امروز می‌خوام انجام بدم اینه که درباره اینکه چرا ما در این حباب حق به جانب بودن گیر میفتیم، صحبت کنم.,False,199000,1126
1987,2014,2000,پس کاری که من امروز می‌خوام انجام بدم اینه که درباره اینکه چرا ما در این حباب حق به جانب بودن گیر میفتیم، صحبت کنم.,False,202000,1126
1988,2015,3000,و سپس درباره اینکه چرا این مساله اینقدر مهمه.,False,204000,1126
1989,2016,2000,و در نهایت می‌خوام شما رو متقا‌عد کنم که شما میتونید از این احساس پا به بیرون بذارید،,False,207000,1126
1990,2017,2000,و در نهایت می‌خوام شما رو متقا‌عد کنم که شما میتونید از این احساس پا به بیرون بذارید،,False,209000,1126
1991,2018,2000,و در نهایت می‌خوام شما رو متقا‌عد کنم که شما میتونید از این احساس پا به بیرون بذارید،,False,211000,1126
1992,2019,2000,و اگه قادر به انجام اون بودین، این تنها و شاید بزرگترین جهشی هست که در زندگیتون انجام خواهید داد.,False,213000,1126
1993,2020,2000,و اگه قادر به انجام اون بودین، این تنها و شاید بزرگترین جهشی هست که در زندگیتون انجام خواهید داد.,False,215000,1126
1994,2021,3000,و اگه قادر به انجام اون بودین، این تنها و شاید بزرگترین جهشی هست که در زندگیتون انجام خواهید داد.,False,217000,1126
1995,2022,2000,خب، چرا ما در این دام حق به جانب بودن گیر میفتیم.,True,222000,1126
1996,2023,2000,خب، چرا ما در این دام حق به جانب بودن گیر میفتیم.,False,224000,1126
1997,2024,3000,یه دلیلش به خاطر احساسیه که فرد درباره اشتباه کردن داره.,False,226000,1126
1998,2025,2000,پس بذارین ازتون یه سوال بپرسم، یا از شما که این نزدیک نشستید.,False,229000,1126
1999,2026,4000,پس بذارین ازتون یه سوال بپرسم، یا از شما که این نزدیک نشستید.,False,231000,1126
2000,2027,3000,از لحاظ عاطفی چه حسی داره وقتی‌ آدم اشتباه کرده باشه.,False,235000,1126
2001,2028,3000,از لحاظ عاطفی چه حسی داره وقتی‌ آدم اشتباه کرده باشه.,False,238000,1126
2002,2029,3000,رنج آور. شصت پایین. شرم آور.,False,241000,1126
2003,2030,2000,رنج آور. شصت پایین. شرم آور.,False,244000,1126
2004,2031,2000,"رنج آور. شصت پایین. شرم آور , ممنون، اینا جوابهای عالی‌ هستند، ولی‌ در واقع جواب یه سوال دیگه اند.",False,246000,1126
2005,2032,3000,"رنج آور. شصت پایین. شرم آور , ممنون، اینا جوابهای عالی‌ هستند، ولی‌ در واقع جواب یه سوال دیگه اند.",False,248000,1126
2006,2033,3000,"رنج آور. شصت پایین. شرم آور , ممنون، اینا جوابهای عالی‌ هستند، ولی‌ در واقع جواب یه سوال دیگه اند.",False,251000,1126
2007,2034,2000,شما در واقع به این سوال جواب دادین که. چه حسی داره وقتی‌ متوجه بشید که اشتباه کردید.,False,254000,1126
2008,2035,3000,شما در واقع به این سوال جواد دادین که. چه حسی داره وقتی‌ متوجه بشید که اشتباه کردید.,False,256000,1126
2009,2037,3000,پی‌ بردن به اشتباه همه این حسّ‌ها رو به دنبال داره، به علاوه خیلی‌ حس های دیگه، درسته.,False,263000,1126
2010,2038,3000,یعنی‌ حتا میتونه ویرانگر باشه، الهام بخش باشه، حتا میتونه کاملا خنده دار باشه.,False,266000,1126
2011,2039,2000,یعنی‌ حتا میتونه ویرانگر باشه، الهام بخش باشه، حتا میتونه کاملا خنده دار باشه.,False,269000,1126
2012,2040,3000,مثل اشتباه من درباره اون علامت چینی‌.,False,271000,1126
2013,2041,3000,ولی‌ در اشتباه بودن بتنهایی، هیچ حس خاصی‌ نداره.,False,274000,1126
2014,2042,2000,ولی‌ در اشتباه بودن بتنهایی، هیچ حس خاصی‌ نداره.,False,277000,1126
2015,2043,3000,من براتون یه مثال میزنم. کارتونهای Loony Tunes رو یادتون میاد.,True,279000,1126
2016,2044,2000,من براتون یه مثال میزنم. کارتونهای Loony Tunes رو یادتون میاد.,False,282000,1126
2017,2045,2000,که یه گرگ صحرایی احساساتی توشه که همش داره مرغ فاخته رو دنبال میکنه و هیچ وقت هم نمیتونه بگیردش.,False,284000,1126
2018,2046,2000,که یه گرگ صحرایی احساساتی توشه که همش داره مرغ فاخته رو دنبال میکنه و هیچ وقت هم نمیتونه بگیردش.,False,286000,1126
2019,2047,3000,تقریبا در همه قسمتای این کارتون یه لحظه‌ای هست که گرگه داره دنبال مرغ میزنه،,False,288000,1126
2020,2048,2000,تقریبا در همه قسمتای این کارتون یه لحظه‌ای هست که گرگه داره دنبال مرغ ميكنه،,False,291000,1126
2021,2049,2000,و مرغه میپره میره روی یه صخره، که خوب طبیعی هست، چون مرغ بال داره و میتونه این کار رو بکنه.,False,293000,1126
2022,2050,3000,و مرغه میپره میره روی یه صخره، که خوب طبیعی هست، چون مرغ بال داره و میتونه این کار رو بکنه.,False,295000,1126
2023,2051,4000,و نکته اینجاست که گرگه دنبالش میدوه و میره بالای صخره.,False,298000,1126
2024,2052,2000,"و جالب اینجاست, حد اقل اگه ۶ساله باشی‌ , که گرگه هم کارش بامزه است.",False,302000,1126
2025,2053,2000,"و جالب اینجاست, حد اقل اگه ۶ساله باشی‌ , که گرگه هم کارش بامزه است.",False,304000,1126
2026,2054,2000,"و جالب اینجاست, حد اقل اگه ۶ساله باشی‌ , که گرگه هم کارش بامزه است.",False,306000,1126
2027,2055,2000,"اون به دویدنش ادامه میده , تا وقتی‌ که به پایین نگاه میکنه و متوجه میشه که وسط زمین و هوا ایستاده.",False,308000,1126
2028,2056,2000,"اون به دویدنش ادامه میده , تا وقتی‌ که به پایین نگاه میکنه و متوجه میشه که وسط زمین و هوا ایستاده.",False,310000,1126
2029,2057,3000,"اون به دویدنش ادامه میده , تا وقتی‌ که به پایین نگاه میکنه و متوجه میشه که وسط زمین و هوا ایستاده.",False,312000,1126
2030,2058,3000,توی این لحظه است که اون میافته پایین.,False,315000,1126
2031,2059,2000,وقتی‌ ما درباره چیزی در اشتباهیم، قبل از اینکه به اون پی‌ ببریم، ما مثل اون گرگه هستیم،,False,319000,1126
2032,2060,3000,وقتی‌ ما درباره چیزی در اشتباهیم، قبل از اینکه به اون پی‌ ببریم، ما مثل اون گرگه هستیم،,False,321000,1126
2033,2061,3000,لحظه‌ای که رفته بالای صخره و قبل از اینکه به پایین نگاه کنه.,False,324000,1126
2034,2062,3000,لحظه‌ای که رفته بالای صخره و قبل از اینکه به پایین نگاه کنه.,False,327000,1126
2035,2063,3000,حالا میدونیم که ما الان در اشتباهیم، میدونیم الان در خطریم، ولی‌ فکر می‌کنیم روی زمین سفت ایستادیم.,False,331000,1126
2036,2064,2000,حالا میدونیم که ما الان در اشتباهیم، میدونیم الان در خطریم، ولی‌ فکر می‌کنیم روی زمین سفت ایستادیم.,False,334000,1126
2037,2065,3000,حالا میدونیم که ما الان در اشتباهیم، میدونیم الان در خطریم، ولی‌ فکر می‌کنیم روی زمین سفت ایستادیم.,False,336000,1126
2038,2066,3000,الان وقتشه که چیزی که چند لحظه پیش گفتم رو درستش کنم. وقتی‌ آدم اشتباه می‌کنه هم یه حسّ خاصی‌ داره؛ احساس میکنه که حق با اونه.,False,340000,1126
