index,duration,content,startOfParagraph,startTime,ID
2564,3780,"Man teilt all die Hausarbeit , Reparaturen, Kochen, Gartenarbeit ,",False,701336,2580
2565,2527,aber man teilt auch die emotionale Arbeit.,False,705116,2580
2566,3083,"Anstatt auf eine idealisierte Familieneinheit angewiesen zu sein,",False,707643,2580
2567,2512,"um alle emotionalen Bedürfnisse erfüllt zu bekommen,",False,710726,2580
2568,1463,"hat man zwei Dutzend Menschen,",False,713238,2580
2569,2500,mit denen man über einen harten Arbeitstag reden kann,False,714701,2580
2570,2859,oder die einem im Umgang mit ausfallenden Lehrern helfen.,False,717201,2580
2571,2942,Teenager aus unserer Gemeinschaft,False,720060,2580
2572,4313,holen sich oft Rat von anderen  Erwachsenen als ihren Eltern.,False,723002,2580
2573,3554,"Bell Hooks nannte das  revolutionäre Erziehung,",False,727315,2580
2574,1842,"die bescheidene Anerkennung davon,",True,730869,2580
2575,3130,"dass Kinder gesünder sind, wenn sie mehrere Erwachsene haben,",False,732711,2580
2576,2634,auf die sie zählen  und die sie nachahmen können.,False,735841,2580
2577,3097,"Wie sich herausstellt,  sind auch Erwachsene gesünder.",False,738475,2580
2578,2494,"Der Druck ist groß, wenn man versucht,",False,741572,2580
2579,3018,diese perfekte Familie hinter dem weißen Lattenzaun zu sein.,False,744066,2580
2580,2684,"Beim neuen es besser haben, wie ich es nun nenne,",True,747980,2580
2581,2990,"geht es weniger darum, in die perfekte Familie,",False,750664,2580
2582,3499,"sondern mehr in das unvollkommene Dorf zu investieren,",False,753654,2580
2583,2240,"ob das nun Verwandte  unter einem Dach sind,",False,757153,2580
2584,1860,eine Wohngemeinschaft wie meine,False,759397,2580
2585,2300,"oder nur ein paar Nachbarn, die versprechen,",False,761261,2580
2586,2860,sich wirklich kennenzulernen und aufeinander Acht zu geben.,False,763561,2580
2587,2042,Ist das kein gesunder Menschenverstand.,False,766421,2580
2588,2847,"Und dennoch hat uns Geld oft dumm gemacht,",False,768466,2580
2589,2259,wenn es um Kontakte geht.,False,771313,2580
2590,2063,Der bewährteste Wohlstand,False,773575,2580
2591,2553,findet sich in Beziehungen.,False,775638,2580
2592,3870,Das neue es besser haben ist keinesfalls eine individuelle Perspektive.,True,779511,2580
2593,3129,"Falls Sie ein Versager sind oder denken, einer zu sein,",False,783384,2580
2594,1685,gibt es gute Neuigkeiten für Sie.,False,786513,2580
2595,2134,"Vielleicht haben Sie Erfolg gemäß Maßstäben,",False,788198,2580
2596,2120,die Sie bislang  noch nicht akzeptiert haben.,False,790332,2580
2597,4038,"Vielleicht sind Sie ein mäßiger Verdiener, aber ein großartiger Vater. ",False,792452,2580
2598,1919,"Sie mögen nicht Ihr Traumhaus haben,",False,796490,2580
2599,2680,geben aber legendäre Nachbarschaftsparties.,False,798409,2580
2600,1824,"Wenn Sie einen Bilderbucherfolg haben,",False,802462,2580
2601,4105,mögen die Schlussfolgerungen meines Vortrages etwas düsterer für Sie sein.,False,804286,2580
2602,3354,"Nach Ihren eigenen Maßstäben könnten Sie ein Versager sein,",False,808391,2580
2603,3006,aber die Welt honoriert dies nicht.,False,811745,2580
2604,2598,Nur Sie können das wissen.,False,814751,2580
2605,3141,"Ich weiß, ich mache meiner Urgroßmutter,",True,817349,2580
2606,4279,"die so ein kurzes und brutales Leben gelebt hat, keine Ehre,",False,820490,2580
2607,3867,"wenn ich genug Geld verdiene, um mir jeden Komfort zu leisten.",False,824769,2580
2608,3547,Man kann sich nicht aus dem Leiden frei-  oder sich in den Sinn einkaufen.,False,828636,2580
2609,1338,"Kein Haus ist groß genug,",False,832183,2580
2610,3932,"um die Schmerzen auszulöschen, die sie erfahren musste.",False,833525,2580
2611,1278,"Ich mache ihr Ehre,",False,837457,2580
2612,4421,wenn ich so verbunden und mutig wie möglich lebe.,False,838735,2580
2613,3061,Inmitten einer solch weitläufigen Ungewissheit,False,844256,2580
2614,2177,dürfen wir in der Tat unsicher sein.,False,847317,2580
2615,4596,Aber wir können durch diese Unsicherheit zerbrechlich oder gefügig werden.,False,850334,2580
2616,4986,"Wir können uns nach innen kehren, den Glauben an Veränderung verlieren ,",False,854930,2580
2617,2418,sogar den Glauben an uns selbst.,False,859916,2580
2618,1962,"Oder wir richten uns nach außen,",False,862334,2580
2619,3023,"und pflegen den Glauben  an unsere Fähigkeit,",False,864300,2580
2620,3740,"für andere da zu sein, Anschluss zu suchen und etwas zu erschaffen.",False,867323,2580
2621,2984,"Wie sich herausstellt, ist die größte Gefahr nicht,",True,871063,2580
2622,3611,die Erfüllung des amerikanischen Traums zu verfehlen.,False,874047,2580
2623,2434,"Die größte Gefahr ist es, einen Traum zu erfüllen,",False,877658,2580
2624,2357,an den man nicht wirklich glaubt.,False,880092,2580
2625,1700,Also tun Sie das nicht.,False,883362,2580
2626,2656,"Tun sie das Schwerere, das Interessantere,",False,885062,2580
2627,4102,"nämlich ein Leben aufzubauen, in dem Ihre alltägliche Tätigkeit,",False,887718,2580
2628,2740,"die Leute, denen Sie Ihre Liebe, Ihren Einfallsreichtum",False,891820,2580
2629,1462,"und Ihre Energie schenken,",False,894560,2580
2630,2984,Ihrem Glauben so nahe wie möglich kommen.,False,896022,2580
2631,3435,"Das und nichts banales wie Geldverdienen,",False,899010,2580
2632,1993,macht ihren Vorfahren Ehre.,False,902445,2580
2633,3605,Das ist der schöne Kampf.,False,904438,2580
2634,1251,Dankeschön.,True,908861,2580
2638,2983,Hab' dich.,True,13034,1445
2639,3724,Moskitos. Ich hasse sie.,True,16017,1445
2640,1768,Sie nicht.,False,19741,1445
2641,3091,"Dieses grauenhafte Summen nachts um die Ohren,",False,21509,1445
2642,2371,das einen total verrückt macht.,False,24600,1445
2643,2214,"Man weiß, dass er seinen Stachel in die Haut stechen",False,26971,1445
2644,4086,"und das Blut aussaugen will.  Das ist furchtbar, nicht wahr.",False,29185,1445
2645,3381,"Es gibt eigentlich nur eine gute Sache,",False,33271,1445
2646,2380,die mir bei Moskitos einfällt.,False,36652,1445
2647,2711,"Wenn sie nachts in unser Schlafzimmer fliegen,",False,39032,1445
2648,3105,stechen sie lieber meine Frau.,False,41743,1445
2649,1209,"Das ist faszinierend, nicht wahr.",True,44848,1445
2650,4606,Warum bekommt sie mehr Stiche ab als ich.,False,46057,1445
2651,4192,"Die Antwort ist der Geruch, ihr Körpergeruch.",False,50663,1445
2652,2650,Und da wir alle anders riechen und auf unserer Haut,False,54855,1445
2653,4477,"Chemikalien freisetzen, die Moskitos  anziehen oder abstoßen,",False,57505,1445
2654,3432,sind manche von uns anziehender als andere.,False,61982,1445
2655,3230,Also riecht meine Frau besser als ich,False,65414,1445
2656,2786,oder ich stinke einfach mehr als sie.,False,68644,1445
2657,3581,"So oder so, Moskitos finden uns im Dunkeln,",True,71430,1445
2658,2735,indem sie uns erschnüffeln. Sie riechen uns.,False,75011,1445
2659,2710,"Während meiner Doktorarbeit wollte ich genau wissen,",False,77746,1445
2660,2756,welche Chemikalien unserer Haut afrikanische,False,80456,1445
2661,3781,"Malaria-Mücken benutzten, um uns nachts zu finden.",False,83212,1445
2662,3568,"Es gibt eine Reihe von Verbindungen, die sie nutzen.",False,86993,1445
2663,3027,Das würde keine einfache Aufgabe sein.,False,90561,1445
2664,3105,Wir haben deshalb verschiedene Experimente gemacht.,False,93588,1445
2665,2868,Warum haben wir diese Experimente aufgebaut.,False,96693,1445
2666,3353,"Weil die Hälfte der Weltbevölkerung  dem Risiko ausgesetzt ist,",False,99561,1445
2667,3206,sich mit einer tödlichen Krankheit wie Malaria,False,102914,1445
2668,2702,durch einen einfachen Mückenstich zu infizieren.,False,106120,1445
2669,2367,Alle 30 Sekunden stirbt irgendwo auf der Welt,False,108822,1445
2670,3671,ein Kind an Malaria und Paul Levy sprach heute Morgen,False,111189,1445
2671,3847,"über die Metapher von der 727er,  die in den Vereinigten Staaten abstürzt.",False,114860,1445
2672,5581,Also in Afrika kommen wir täglich,False,118707,1445
2673,2801,auf sieben Abstürze von 747ern.,False,124288,1445
2674,3241,"Aber wenn wir diese Mücken in Fallen locken,",False,127089,1445
2675,3701,"sie mit unserem Duft ködern, können wir vielleicht",False,130330,1445
2676,1830,die Übertragung der Krankheit stoppen.,False,134031,1445
2677,2248,"Es wird nicht einfach sein, das Rätsel zu lösen,",True,135861,1445
2678,3237,weil wir hunderte verschiedener  Chemikalien auf unserer Haut produzieren.,False,138109,1445
2679,2417,"Aber wir haben einige beachtliche Experimente durchgeführt,",False,141346,1445
2680,3792,"die uns halfen, dieses Rätsel sehr schnell zu lösen.",False,143763,1445
2681,3363,"Zuerst haben wir beobachtet,  dass nicht alle Arten von Mücken",True,147555,1445
2682,3848,an denselben Körperstellen  zustechen. Merkwürdig.,False,150918,1445
2683,1619,"Also machten wir ein Experiment,",False,154766,1445
2684,3612,dafür setzten wir einen nackten  Freiwilligen in einen großen Käfig,False,156385,1445
2685,3139,"und in diesen Käfig gaben wir Mücken,",False,159997,1445
2686,3319,"um zu sehen, welche Körperstellen  sie bei der Person stechen.",False,163136,1445
2687,2599,Wir fanden bemerkenswerte Unterschiede.,False,166455,1445
2688,2363,Hier links sehen Sie die Stiche,False,169054,1445
2689,2925,der holländischen Malariamücke auf der Person.,False,171417,1445
2690,3028,"Sie hatte eine sehr starke Vorliebe, in das Gesicht zu stechen.",False,174342,1445
2691,2462,Im Gegensatz dazu hat  die afrikanische Malariamücke,False,177370,1445
2692,5805,"eine starke Präferenz, in die Knöchel  und Füße der Personen zu stechen.",False,179832,1445
2693,2465,"Das hätten wir uns natürlich  schon denken können,",False,185637,1445
2694,4472,"weil sie ja Moski-toes [-Zehen]  heißen, klar. ",False,188102,1445
2695,3107,Ganz recht. ,False,192574,1445
2696,5653,"Also begannen wir, uns auf den  Geruch der Füße zu konzentrieren,",True,195681,1445
2697,1572,"auf den Geruch menschlicher Füße,",False,201334,1445
2698,3702,"bis wir auf diese bemerkenswerte Aussage in der Literatur stießen,",False,202906,1445
2699,3658,"die lautete, dass Käse nach Füßen riecht,",False,206608,1445
2700,4082,eher als andersrum. Denken Sie mal drüber nach.,False,210266,1445
2701,2259,"Und das hat uns dazu veranlasst,  ein bemerkenswertes Experiment zu machen.",False,214348,1445
2702,4379,"Wir versuchten mit einem  kleinen Stück Limburgerkäse,",False,216607,1445
2703,2672,"der nach stinkenden Füßen riecht,",False,220986,1445
2704,2497,afrikanische Malariamücken anzulocken.,False,223658,1445
2705,2732,Und wissen Sie was. Es funktionierte.,False,226155,1445
2706,5335,"Tatsächlich hat es so gut funktioniert,  dass wir jetzt eine synthetische Mischung",False,228887,1445
2707,4514,"von Limburgerkäse-Aroma haben,  das wir in Tansania verwenden.",False,234222,1445
2708,2112,"Dort hat sich gezeigt, dass es für Mücken",False,238736,1445
2709,3882,zwei- bis dreimal attraktiver ist als das der Menschen.,False,240848,1445
2710,3521,"Limburg, sei stolz auf deinen Käse,",False,244730,1445
2711,3197,weil er jetzt im Kampf gegen Malaria eingesetzt wird.,False,248251,1445
2713,2934,"Nur damit Sie es sehen, das ist der Käse.",False,258244,1445
2714,3179,Meine zweite Geschichte  ist auch außergewöhnlich.,True,261178,1445
2715,3615,Sie handelt vom besten Freund  des Menschen. vom Hund.,False,264357,1445
2716,993,"Und ich werde Ihnen zeigen,",False,267972,1445
2717,3137,wie wir Hunde im Kampf gegen  Malaria einsetzen können.,False,268965,1445
2718,3668,"Eine der besten Methoden, Mücken zu töten,",False,272102,1445
2719,2955,"ist, nicht zu warten bis sie  ausgewachsen herumfliegen,",False,275770,1445
2720,3087,Menschen stechen und  die Krankheit übertragen.,False,278725,1445
2721,3903,"Es ist besser, sie zu töten, wenn  sie noch als Larven im Wasser sind.",False,281812,1445
2722,4725,Warum. Sie sind nämlich wie die CIA.,False,285715,1445
2723,4152,In diesem Wasserbecken  sind die Larven konzentriert.,False,290440,1445
2724,2682,Sie sind alle zusammen.  Sie sind unbeweglich.,False,294592,1445
2725,3168,Sie können nicht aus dem Wasser  entkommen. Sie können nicht fliegen.,False,297274,1445
2726,3457,Und sie sind erreichbar. Man kann direkt,False,300442,1445
2727,4259,"zu der Lache gehen und sie töten, richtig.",False,303899,1445
2728,3872,"Das Problem dabei ist, dass",True,308158,1445
2729,3161,in der gesamten Landschaft diese Wasserlachen,False,312030,1445
2730,2723,"mit den Larven, überall verteilt sind,",False,315191,1445
2731,2908,"was es für einen Kontrolleur  sehr schwierig macht,",False,317914,1445
2732,3978,all die Brutstätten zu finden und  mit Insektiziden zu behandeln.,False,320822,1445
2733,2531,"Letztes Jahr dachten wir angestrengt darüber nach,",False,324800,1445
2734,3375,"wie wir das Problem lösen können. Bis wir merkten,",False,327331,1445
2735,3263,"dass genauso wie wir einen  einzigartigen Geruch haben,",False,330706,1445
2736,4511,auch die Mückenlarven einen  einzigartigen Geruch haben.,False,333969,1445
2737,2093,"Also führten wir ein anderes  verrücktes Experiment durch,",True,338480,1445
2738,2072,"indem wir den Geruch der Larven einfingen,",False,340573,1445
2739,4366,ihn auf ein Stück Stoff auftrugen und  etwas Bemerkenswertes machten.,False,342645,1445
2740,2393,Hier haben wir einen Balken mit vier Löchern,False,347011,1445
2741,2803,und wir gaben den Geruch  der Larven in das linke Loch.,False,349404,1445
2742,1075,"Oh, das war sehr schnell.",False,352207,1445
2743,2444,Jetzt sehen Sie den Hund. Er heißt  Tweed und ist ein Border Collie.,False,353282,1445
2744,2915,Er untersucht diese Löcher  und jetzt hat er's schon.,False,355726,1445
2745,2497,"Er geht zurück und untersucht  nochmal die Kontrolllöcher,",False,358641,1445
2746,1483,aber er geht wieder zum ersten zurück,False,361138,1445
2747,2657,"und jetzt fixiert er sich auf den Geruch,",False,362621,1445
2748,2230,"was bedeutet, dass wir  jetzt Hunde nutzen können,",False,365278,1445
2749,2328,damit sie zusammen  mit den Kontrolleuren,False,367508,1445
2750,2384,die Brutstätten der Mücken  im Gebiet viel besser finden,False,369836,1445
2751,2869,und damit einen viel stärkeren  Effekt auf Malaria haben.,False,372220,1445
2752,3714,"Das ist Ellen van der Zweep. Sie ist eine  der besten Hundetrainerinnen der Welt,",False,375089,1445
2753,2875,"und sie glaubt, dass wir noch viel mehr tun können.",False,378803,1445
2754,3718,"Da wir wissen, dass Menschen,  die Malariaparasiten in sich tragen",False,381678,1445
2755,2976,"anders riechen als Menschen,  die nicht infiziert sind,",False,385396,1445
2756,2306,"glaubt sie, dass wir Hunde trainieren können,",False,388372,1445
2757,3690,"Menschen zu erkennen,  die Parasiten in sich tragen.",False,390678,1445
2758,2183,"Das bedeutet, dass in einer Bevölkerung, in der Malaria",False,394368,1445
2759,3893,"abklingt und nur wenige Menschen  noch Parasiten haben,",False,396551,1445
2760,1579,Hunde diese Menschen finden können.,False,400444,1445
2761,4239,Wir können sie mit Anti-Malariamitteln behandeln  und Malaria den letzten Schlag versetzen.,False,402023,1445
2762,3508,Der beste Freund des Menschen  im Kampf gegen Malaria.,False,406262,1445
2763,3038,Meine dritte Geschichte ist  vielleicht noch erstaunlicher,True,409770,1445
2764,4849,und wurde bis heute noch  keinem Publikum gezeigt.,False,412808,1445
2765,2070,Ja.,False,417657,1445
2766,3206,"Es ist eine verrückte Geschichte,  aber es ist wahrscheinlich die beste",False,419727,1445
2767,3319,und ultimativste Rache an den Mücken.,False,422933,1445
2768,3174,"Leute haben mir sogar gesagt, dass sie jetzt gerne",False,426252,1445
2769,3062,von Mücken gestochen werden.,False,429426,1445
2770,2708,"Die Frage ist natürlich, was jemanden dazu bringt,",False,432488,1445
2771,2610,gerne von Mücken gestochen zu werden.,False,435196,1445
2772,1260,Die Antwort,False,437806,1445
2773,4117,"trage ich direkt hier in meiner Tasche,",False,439066,1445
2774,2710,wenn ich sie kriege.,False,443183,1445
2775,3346,Es ist eine einfache Tablette,False,445893,1445
2776,2882,"und wenn ich sie mit Wasser einnehme,",False,449239,1445
2777,4275,bewirkt sie Wunder.,False,452121,1445
2778,1673,Danke.,False,456396,1445
2780,4016,"Ich zeige Ihnen jetzt, wie das funktioniert.",True,464029,1445
2781,3017,In dieser Box habe ich einen Käfig,False,468045,1445
2782,4794,mit hunderten hungriger,False,471062,1445
2783,4467,"weiblicher Mücken,",False,475856,1445
2784,3888,die ich gleich frei lassen werde. ,False,480323,1445
2785,3120,Ich mach nur Spaß.,False,484211,1445
2786,2892,"Ich werde Ihnen zeigen, wie ich  meinen Arm hineinstecken werde",False,487331,1445
2787,2715,"und Sie werden sehen,  wie schnell sie zustechen.",False,490223,1445
2788,1997,Los geht's.,False,492938,1445
2789,3422,"Keine Sorge, in unserem Labor mache ich das andauernd.",False,494935,1445
2790,3802,"Also, los. Okay.",False,498357,1445
2791,5043,Auf dem Video hier,False,502159,1445
2792,1368,"zeige ich Ihnen genau das gleiche,",False,507202,1445
2793,2759,"außer dass das, was Sie auf dem Video sehen",False,508570,1445
2794,3566,eine Stunde nachdem ich ein  Tablette genommen habe passiert ist.,False,511329,1445
2795,4724,"Schauen Sie. Das funktioniert nicht. Okay, tut mir leid.",False,514895,1445
2796,2399,"Ich stecke meinen Arm rein,  ich bereite Ihnen ein großes saftiges",False,519619,1445
2797,2268,"blutiges Mahl, ich schüttele sie ab  und wir verfolgen sie über die Zeit",False,522018,1445
2798,3017,"und sehen, dass die Mücken sehr sehr krank werden.",False,524286,1445
2799,2159,Hier sieht man es im Zeitraffer.,False,527303,1445
2800,3364,Und drei Stunden später sehen wir am Boden,False,529462,1445
2801,3084,"des Käfigs tote Mücken,",False,532826,1445
2802,4331,"sehr tote Mücken und ich sage Ihnen, meine Damen und Herren,",False,535910,1445
2803,1865,wir haben mit den Mücken die Seiten getauscht.,False,540241,1445
2804,4720,"Wir töten sie, nicht sie uns.",False,542106,1445
2806,6084,Nun –  –,True,554983,1445
2807,1838,"sei bereit, Maastricht.",False,561067,1445
2808,2126,"Stellen Sie sich vor, was wir damit machen können.",False,562905,1445
2809,2198,"Wir können das nutzen, um Ausbrüche von Krankheiten,",False,565031,1445
2810,3386,"die durch Mücken übertragen werden, einzudämmen.",False,567229,1445
2811,2017,"Und mehr noch, stellen Sie sich vor, was passiert,",False,570615,1445
2812,3059,"wenn in einem großem Gebiet jeder  diese Medikamente nehme würde,",False,572632,1445
2813,2261,"dieses Medikament, nur drei Wochen lang.",False,575691,1445
2814,2408,"Dadurch wären wir tatsächlich in der Lage,",False,577952,1445
2815,1610,Malaria als Erkrankung auszulöschen.,False,580360,1445
2816,4094,"Mit Käse, Hunden und einer Pille töten wir Mücken.",True,581970,1445
2817,3638,"Das ist die Art von ganzheitlicher  Wissenschaft, die ich gerne betreibe,",False,586064,1445
2818,2505,"zum Wohl der Menschheit,",False,589702,1445
2819,2801,"aber besonders für sie,  damit sie in einer Welt",False,592207,1445
2820,4800,ohne Malaria aufwachsen kann.  Danke. ,False,595008,1445
3226,3330,Der Aufschrei der Menge. Das Brüllen eines Löwen.,False,6998,44216
3227,1650,Das Klirren von Metall.,False,10328,44216
3228,4613,Ab 80 n. Chr. ertönten diese Klänge über die Ränge des Kolosseums.,False,11978,44216
3229,3853,Fast das ganze Jahr über füllten über 50.000 Einwohner Roms,False,17013,44216
3230,4420,"und Besucher aus dem Römischen Reich die vier Stockwerke des Stadions,",False,20866,44216
3231,5465,"um in der Arena Gladiatorenduelle, Tierkämpfe und Wagenrennen zu sehen.",False,25286,44216
3232,4299,Zum großen Finale strömte Wasser herein,False,31203,44216
3233,3529,und überschwemmte die Bühne für ein grandioses Spektakel.,False,35502,44216
3234,2170,inszenierte Seeschlachten.,False,39300,44216
3235,4262,"Die monumentalen fiktiven Seekämpfe der Römer, Naumachien genannt,",False,41940,44216
3236,3947,"begannen unter Julius Caesar im 1. Jahrhundert v. Chr.,",False,46202,44216
3237,3147,über hundert Jahre vor der Erbauung des Kolosseums.,False,50149,44216
3238,3005,Sie wurden neben anderen Wasserspektakeln,False,53773,44216
3239,3468,"auf natürlichen und künstlichen Gewässern um Rom abgehalten,",False,56778,44216
3240,2818,"und zwar bis zur Ära von Kaiser Flavius Vespasian,",False,60246,44216
3241,4435,der 70 n. Chr. auf einem ehemaligen See mit dem Bau des Kolosseums begann.,False,63064,44216
3242,4274,Es sollte ein Symbol der Macht Roms in der antiken Welt sein.,False,67869,44216
3243,4140,"Wie könnte man diese Macht besser zeigen als mit einem Gewässer,",False,72143,44216
3244,3379,das sich auf kaiserlichen Befehl leeren und füllen ließ.,False,76283,44216
3245,5630,Vespasians Sohn Flavius Titus erfüllte 80 n. Chr. den Traum seines Vaters.,False,80103,44216
3246,3345,Mit Hilfe von Kriegsbeute vollendete er das Kolosseum,False,85733,44216
3247,4012,"bzw. das Flavische Amphitheater, wie es damals genannt wurde.",False,89078,44216
3248,4995,Die Eröffnung wurde 100 Tage lang mit Prunk und Gladiatorenspielen gefeiert,False,93675,44216
3249,4699,"und bildete die Programmvorlage für Paraden, musikalische Aufführungen,",False,99101,44216
3250,4453,öffentliche Hinrichtungen und natürlich Gladiatorenkämpfe.,False,103800,44216
3251,4172,"Im Gegensatz zu kleineren Arenen, wo reiche Römer Spiele veranstalteten,",False,108928,44216
3252,4129,wurden diese Demonstrationen imperialer Macht vom Kaiser finanziert.,False,113100,44216
3253,2916,"Paraden exotischer Tiere, Theateraufführungen",False,117229,44216
3254,3127,"und die imposanten Naumachien wurden ersonnen,",False,120145,44216
3255,2902,"um den Glauben an den gottgleichen Kaiser zu stärken,",False,123272,44216
3256,2866,der nach seinem Tod zum Gott erklärt würde.,False,126174,44216
3257,2977,"Es bleibt ein Rätsel, wie Ingenieure die Arena fluteten",False,129640,44216
3258,2060,und den aquatischen Effekt erzeugten.,False,132617,44216
3259,4071,Laut einiger Historiker wurde ein riesiger Aquädukt in die Arena geleitet.,False,134677,44216
3260,2978,"Andere denken, das System der Kammern und Schleusentore",False,138827,44216
3261,3239,zum Leeren der Arena wurde auch zum Füllen verwendet.,False,141805,44216
3262,2562,Die Kammern wurden wohl vor der Vorstellung,False,145594,44216
3263,2136,"mit Wasser gefüllt und dann geöffnet,",False,148156,44216
3264,2998,um die Bühne mit knapp 4 Millionen Litern Wasser,False,150292,44216
3265,2252,anderthalb Meter hoch zu überfluten.,False,153290,44216
3266,2067,Aber trotz des vielen Wassers,False,155792,44216
3267,3961,"mussten die Römer Miniaturboote mit speziell flachen Böden bauen,",False,157859,44216
3268,2621,damit sie nicht auf dem Grund aufliefen.,False,161820,44216
3269,3235,"Diese Boote waren 7 bis 15 m lang und wurden so gebaut,",False,164526,44216
3270,3361,dass sie wie Schiffe von berühmten Schlachten aussahen.,False,167761,44216
3271,3954,Während einer Schlacht schwammen Dutzende dieser Schiffe in der Arena.,False,171340,44216
3272,1495,"An Bord waren Gladiatoren,",False,175294,44216
3273,3475,verkleidet als Kriegsparteien der reinszenierten Schlacht.,False,176789,44216
3274,2498,"Die Krieger duellierten sich von Schiff zu Schiff,",False,180264,44216
3275,3245,"enterten Schiffe, bekämpften und vernichteten ihre Feinde,",False,182762,44216
3276,2831,bis nur noch eine Partei übrig blieb.,False,186007,44216
3277,2699,Zum Glück erzählten nicht alle Wasserschauspiele,False,189947,44216
3278,1829,solch grausige Geschichten.,False,192646,44216
3279,2815,Bei einigen Aufführungen glitten Wagenlenker,False,194475,44216
3280,3581,"dank der überfluteten Bühne wie Triton über das Wasser,",False,197290,44216
3281,3448,"der, Wellen schlagend, seinen Wagen über das Meer lenkte.",False,200871,44216
3282,4630,"Tiere liefen auf dem Wasser, Mythen wurden von verurteilten Gefangenen nachgestellt",False,204569,44216
3283,4419,und nachts traten nackte Synchronschwimmer im Fackelschein auf.,False,209199,44216
3284,3781,Aber das aquatische Zeitalter des Kolosseums währte nicht ewig.,False,214167,44216
3285,2318,"Die Seeschlachten waren so beliebt,",False,218149,44216
3286,3410,dass ihnen Kaiser Domitian Ende des 1. Jahrhunderts n. Chr.,False,220467,44216
3287,2217,einen eigenen See in der Nähe zuwies.,False,223877,44216
3288,3022,Dieser größere See war für Naumachien noch geeigneter,False,226094,44216
3289,4553,"und das Kolosseum erhielt bald eine Reihe unterirdische Tierkäfige und Falltüren,",False,229116,44216
3290,2437,die keine weiteren Überflutungen zuließen.,False,233669,44216
3291,1569,Aber für kurze Zeit,False,236106,44216
3292,3399,steuerten die flavischen Kaiser die Gezeiten von Krieg und Wasser,False,237675,44216
3293,2720,in einer spektakulären Machtdemonstration.,False,241074,44216
3376,3922,"Die meisten Menschen glauben, dass neue",True,857,3694
3377,4679,oder fortgeschrittene Technologien niemals aus Afrika kommen können.,False,4869,3694
3378,3704,"Stattdessen denken sie, dass man dem Kontinent am besten hilft,",False,10149,3694
3379,2820,"indem man Hilfe oder Dienstleistungen bereitstellt,",False,13877,3694
3380,2426,die der Kontinent nicht selbst liefern kann.,False,16697,3694
3381,2961,"Während wir also sehen, wie fortgeschrittene Technologien",False,19864,3694
3382,2037,wie Roboter und Künstliche Intelligenz,False,22825,3694
3383,2414,"in der entwickelten Welt exponentiell wachsen,",False,24862,3694
3384,2189,"sorgen sich dieselben Menschen darüber,",False,27276,3694
3385,3547,dass ein technologisch unterentwickeltes Afrika zurückfällt.,False,29465,3694
3386,3648,Diese Einstellung könnte falscher nicht sein.,False,33012,3694
3387,4142,Als Unternehmer im Bereich Robotics verbrachte ich viel Zeit hier in Afrika.,True,37435,3694
3388,3946,"2014 gründeten wir Zipline,",False,41577,3694
